id,title,description,image_link,link,product_type,brand,price,availability,item_group_id,checkout_url,additional_image_link,sale_price_effective_date,sale_price,condition,visibility,gender,color,size,pattern,google_product_category,default_product,variant
CERPASGSARACM1_2305_24176,"Ditalini g 250 di grano saraceno","Maciniamo il grano saraceno con un metodo unico che consente di ottenere una farina 100% integrale e successivamente la pastifichiamo utilizzando un processo di lenta essiccazione a bassa temperatura che mantiene inalterate la maggior parte delle proprietà nutrizionali ed organolettiche del chicco. La pasta di grano saraceno è ricca di proteine ed è fonte di magnesio e fosforo. Modalità di conservazione: conservare in luogo fresco, asciutto, inodore e al riparo dai raggi solari e da fonti di calore. Ditalini di grano saraceno g 500 Ingredienti: farina biologica di grano saraceno Allergeni: contiene glutine. Può contenere tracce di altri cereali contenenti glutine (grano, grano farro e grano Khorasan, segale, orzo, avena), soia e sesamo. Paese di coltivazione del farro: UE Paese di molitura: Italia   Valori nutrizionali. Valori medi per 100g. Energia: 1519 kJ / 359 kcal Grassi: 3.4 g di cui acidi grassi saturi: 0.7 g Carboidrati:66 g di cui zuccheri: 3.4 g Fibre: 4,2 g Proteine: 14 g Sale: 0 g Fosforo 427 mg 53% VNR**Magnesio 170 mg 45% VNR* *VNR= Valori Nutritivi di Riferimento 45% sul prodotto crudo pari al 30% sul prodotto preparato secondo le istruzioni**VNR= Valori Nutritivi di Riferimento 53% sul prodotto crudo pari al 30% sul prodotto preparato secondo le istruzioni.",https://agrispesa.loc/wp-content/uploads/2023/02/default-300x300.png,https://agrispesa.loc/negozio/pane-cereali/pasta-per-minestre/ditalini/,"Pastina","Agrispesa",3.4EUR,in stock,CERPASGSARACM1_2305_24176,,,,0,new,published,,,,,,,
CERSNACK2_2305_24177,"Palline soffiate g 50 di mais e riso","Le palline di mais e riso sono realizzate solo con farina e sale, senza grassi. Da gustare come spuntino o aperitivo. Modalità di conservazione: conservare in luogo fresco, asciutto, inodore e al riparo dai raggi solari e da fonti di calore.Prodotto estruso di mais con riso.Ingredienti: farina di mais biologica 68%, farina integrale di riso biologica 30%, sale marinoAllergeni: può contenere tracce di cereali contenenti glutine (grano, grano farro e grano Khorasan, segale, orzo, avena), soia e sesamo.Origine ItaliaValori nutrizionali. Valori medi per 100g.Energia: 1521 kJ / 359 kcalGrassi: 1.4 g di cui acidi grassi saturi: 0.3 gCarboidrati: 78 g di cui zuccheri: 0 gFibre: 2.6 gProteine: 7.2 gSale: 3.6 g",https://agrispesa.loc/wp-content/uploads/2023/02/default-300x300.png,https://agrispesa.loc/negozio/palline-soffiate/,"Piatti preparati, Spuntini, Negozio","Agrispesa",1.19EUR,in stock,CERSNACK2_2305_24177,,,,0,new,published,,,,,,,
CERSNACK6_2305_24181,"Palline soffiate g 50 di mais e lenticchie","Le palline di mais e lenticchie rosse sono 100% vegetali, non sono fritte, sono realizzate solo con farina di legumi, farina di mais e sale, senza aggiunta di olio. Sono ricche di proteine, fibre, fosforo e manganese, fonte di ferro e a basso contenuto di grassi saturi. Senza olio di palma e senza lattosio. Da gustare come spuntino o aperitivo. Modalità di conservazione: conservare in luogo fresco, asciutto, inodore e al riparo dai raggi solari e da fonti di calore.Prodotto estruso di mais con lenticchie. Ingredienti: farina biologica di lenticchie rosse 51%, farina di mais biologica 48%, sale Allergeni: può contenere tracce di cereali contenenti glutine (grano, grano farro e grano Khorasan, segale, orzo, avena), soia e sesamo. Valori nutrizionali. Valori medi per 100g.Energia: 1510 kJ / 357 kcalGrassi: 1.6 g di cui acidi grassi saturi: 0.4 gCarboidrati: 64 g di cui zuccheri: 0.7 gFibre: 7.1 gProteine: 18 gSale: 3.7 gFerro 3.55 mg (25% VNR*)Fosforo 230 mg 32% VNR*Manganese 0,64 mg 32% VNR* *VNR= Valori Nutritivi di Riferimento",https://agrispesa.loc/wp-content/uploads/2023/02/default-300x300.png,https://agrispesa.loc/negozio/palline-soffiate-5/,"Spuntini, Negozio","Agrispesa",2.32EUR,in stock,CERSNACK6_2305_24181,,,,0,new,published,,,,,,,
MIE52_2041_24190,"Miele di acacia g 250","Il miele di acacia è uno dei mieli più conosciuti, apprezzato per le sue caratteristiche di liquidità e per la delicatezza dell’aroma. Il suo aspetto è quasi incolore o giallo paglierino chiaro. Ha un sapore molto dolce, dall’aroma tipicamente vanigliato; per tale motivo è il miele più utilizzato come dolcificante. Ottimo per accompagnare formaggi freschi di primo latte e/o fermentati.Un miele riscaldato sopra i 35° perde quasi tutte le sue proprietà. E’ consigliabile mangiarlo a crudo o comunque farlo sciogliere in bevande tiepide. Modalità di conservazione: conservare in luogo fresco e asciutto, al riparo dalla luce.Miele di acacia da apicoltura biologica biodinamica.",https://agrispesa.loc/wp-content/uploads/2023/02/default-300x300.png,https://agrispesa.loc/negozio/miele-di-acacia/,"Marmellate e miele, Negozio","Agrispesa",10.16EUR,in stock,MIE52_2041_24190,,,,0,new,published,,,,,,,
LATTE5_2248_24158,"Latte di mucca l 1","Il nostro latte deriva da vacche alimentate al pascolo. Il colore giallo è dovuto al betacarotene che c’è nell’erba, è un latte molto più digeribile perché fondamentalmente l’animale mangia quello che dovrebbe mangiare: noi non facciamo niente di strano, semplicemente lo mandiamo a mangiare al pascolo dove sceglie l’erba che vuole mangiare sulla base della giornata, del periodo, della temperatura, della stagione ecc. Il nostro latte ha un rapporto tra omega 6 e omega 3 molto vantaggioso per cui è un latte che fondamentalmente fa bene. Non lo microfiltriamo né lo omogenizziamo. 
  
  Il latte industriale, tutto, viene scremato completamente poi viene riaggiunta della panna per arrivare al titolo di grasso. Inoltre viene microfiltrato, per questo dopo 6 giorni scade, perché la microfiltrazione crea una piccola ossidazione per rompere i globuli del grasso: essendo un latte prodotto da mangimi è poco digeribile e dunque hanno bisogno di rompere i globuli del grasso per renderlo più digeribile. Noi non lo facciamo perché il nostro è già digeribile. E in più sa di latte.",https://agrispesa.loc/wp-content/uploads/2023/02/default-300x300.png,https://agrispesa.loc/negozio/latte-di-mucca/,"Burro, latte e uova, Uova e Latticini, Negozio","Agrispesa",3.66EUR,in stock,LATTE5_2248_24158,,,,0,new,published,,,,,,,
YOGVAINTEROB3_2248_24159,"Yogurt di mucca bianco g 150","Il nostro yogurt è naturale al 100%. 
Le nostre vacche producono 1/3 di quello che produrrebbero se fossero allevate a mangimi. Una frisona, che è la razza per eccellenza della grande produzione di latte, che sono le stesse che abbiamo noi, va dai 40 ai 60 litri al giorno in allevamento convenzionale; in allevamento a pascolo, come facciamo noi, produce dai 15 ai 20 litri al giorno, poi dipende dal periodo, nel periodo in cui è nato il vitello la vacca produce più latte, poi man mano va a scemare. 
Quello che è fondamentale è far mangiare l’animale allo stadio giusto di crescita dell’erba, quando ha i principi nutritivi migliori. Come integrazione proteica, energizzante, diamo un 20% di cereali che sono fondamentalmente mais nazionale, pisello proteico, favino, un po’ di orzo e un po’ di girasole. 
Il nostro latte è un prodotto diverso dagli altri: è giallo perché il betacarotene che c’è nell’erba conferisce la caratteristica, è un latte molto più digeribile, perché fondamentalmente l’animale mangia quello che dovrebbe mangiare, noi non facciamo niente di strano, semplicemente lo mandiamo al pascolo dove sceglie l’erba che vuole. È molto più complicato gestire un allevamento in questo modo perché vuol dire far pascolare dove c’è l’erba all’altezza giusta (né vecchia, né troppo giovane), dipendiamo dal tempo atmosferico. Noi tagliamo solo le infestanti prima dell’infiorescenza e, dove ci sono i buchi perché magari è stata pestata l’erba, facciamo la trasemina, cioè andiamo a riseminare, in modo che dove c’è l’erba buona le infestanti non trovano lo spazio. La gestione è difficile perché, a seconda del tipo di prato dove vanno a pascolare le vacche, se mangiano più di un tipo di erbe rispetto ad altre, si varia un po’ l’integrazione dal punto di vista dei cereali e ciò rende la gestione più complicata rispetto ad aprire un sacco di mangime, rovesciarlo e lasciarle ferme in stalla. Questo ha costi maggiori dal punto di vista della produzione, perché hai meno latte e più costi di gestione, non tanto nell’acquisto del mangime, ma nella gestione. 
Il nostro latte è molto più digeribile per le caratteristiche dell’erba, ha un rapporto tra omega 6 e omega 3 molto vantaggioso per cui è un latte che fondamentalmente fa bene. Il Prof. Berrino, che è contrario all’alimentazione a latte negli adulti, dice che il latte prodotto da cereali è cancerogeno, l’unico che non lo è, è il latte d’erba. Purtroppo il latte che si trova in commercio deriva da vacche tenute in stalla, nella migliore delle ipotesi a stabulazione libera, cioè possono camminare e non sono bloccate dentro delle cuccette, ma mangiano mangimi composti per l’80% da cereali se non addirittura infilati, fermentati, mangimi in cui mescolano le foglie del mais trinciate. Una vacca, in natura, non mangerebbe mai una foglia di mais. 
Modalità di conservazione: conservare in frigorifero a 4°C. 
Ingredienti: LATTE vaccino. 
Allergeni. Contiene LATTE.",https://agrispesa.loc/wp-content/uploads/2023/02/default-300x300.png,https://agrispesa.loc/negozio/latticini/yogurt/yogurt-di-mucca-bianco-2/,"Yogurt","Agrispesa",2.9EUR,in stock,YOGVAINTEROB3_2248_24159,,,,0,new,published,,,,,,,
YOGVAINTEROF2_2248_24160,"Yogurt di mucca frutta g 150","Il nostro yogurt è naturale al 100%, le composte che utilizziamo sono quelle biologiche di Sanapianta. Tendiamo a lavorare con produttori piccoli, locali, con la nostra stessa filosofia. Modalità di conservazione: conservare in frigorifero a 4°C.YogurtIngredienti: LATTE vaccino.Allergeni. Contiene LATTE.",https://agrispesa.loc/wp-content/uploads/2023/02/default-300x300.png,https://agrispesa.loc/negozio/latticini/yogurt/yogurt-di-mucca-frutta-2/,"Yogurt","Agrispesa",3.27EUR,in stock,YOGVAINTEROF2_2248_24160,,,,0,new,published,,,,,,,
CERPASGDUROC12_2305_24169,"Conchiglie g 500 di farro","La nostra pasta è prodotta solo con materie prime biologiche selezionate. Il farro che utilizziamo è della varietà 'Triticum dicoccum' un antico cereale alternativo al grano moderno. Questa è la varietà più dura e più pregiata, ricca di proteine, fibre e ferro. Il nostro farro è tutto da agricoltura biologica ed è 100% di origine italiana. Lo maciniamo personalmente con un metodo unico per ottenere una farina 100% integrale, poi lo pastifichiamo utilizzando un processo di lenta essiccazione a bassa temperatura che consente di mantenere la maggior parte delle proprietà nutrizionali ed organolettiche del chicco. Modalità di consumo: cuocere in abbondante acqua salata per circa 5-7 minuti. Modalità di conservazione: conservare in luogo fresco, asciutto, inodore e al riparo dai raggi solari e da fonti di calore. Conchiglie di farro integrale g 500Ingredienti: farina integrale biologica di farro 'Triticum dicoccum' Allergeni: contiene glutine. Può contenere tracce di altri cereali contenenti glutine (grano, grano Khorasan, segale, orzo, avena), soia e sesamo. Paese di coltivazione del farro: Italia Paese di molitura: Italia Valori nutrizionali. Valori medi per 100g.Energia: 1406 kJ / 333 kcal Grassi: 3.0 g di cui acidi grassi saturi: 0.8 gCarboidrati:58 g di cui zuccheri: 3.8 g Fibre: 11 g Proteine: 13 g Sale: 0 g",https://agrispesa.loc/wp-content/uploads/2023/02/default-300x300.png,https://agrispesa.loc/negozio/conchiglie/,"Pasta di grano duro, Negozio","Agrispesa",4.61EUR,in stock,CERPASGDUROC12_2305_24169,,,,0,new,published,,,,,,,
CERPASGDUROC17_2305_24171,"Stelline g 500 di grano duro","Pastina ideale per minestre. Le stelline sono realizzate con pasta di semola di grano duro italiano da agricoltura biologica.",https://agrispesa.loc/wp-content/uploads/2023/02/default-300x300.png,https://agrispesa.loc/negozio/pane-cereali/pasta-per-minestre/stelline/,"Pastina","Agrispesa",2.23EUR,in stock,CERPASGDUROC17_2305_24171,,,,0,new,published,,,,,,,
CERPASGDUROC19_2305_24172,"Alfabeto g 500 di grano duro","La nostra pasta è prodotta solo con materie prime biologiche selezionate. Il grano duro che utilizziamo è 100% di origine italiana. La pastificazione è caratterizzata da una lenta essiccazione a bassa temperatura che consente di salvaguardare la maggior parte delle proprietà nutrizionali e il sapore proprio del grano. Il risultato è una pasta di qualità da agricoltura biologica. L’alfabeto è una pastina ideale per minestre. Modalità di consumo: cuocere in abbondante acqua salata per circa 5-7 minuti. Modalità di conservazione: conservare in luogo fresco, asciutto, inodore e al riparo dai raggi solari e da fonti di calore. Pasta di semola di grano duro biologica. Ingredienti: semola di grano duro biologica Allergeni: contiene glutine. Può contenere tracce di altri cereali contenenti glutine (grano farro e grano Khorasan, segale, orzo, avena), soia e sesamo. Paese di coltivazione del grano: Italia Paese di molitura: Italia Valori nutrizionali. Valori medi per 100g. Energia: 1484 kJ / 350 kcal Grassi: 1.7 g di cui acidi grassi saturi: 0.3 g Carboidrati:71 g di cui zuccheri: 3 g Fibre: 3.4 g Proteine: 11 g Sale: 0 g",https://agrispesa.loc/wp-content/uploads/2023/02/default-300x300.png,https://agrispesa.loc/negozio/pane-cereali/pasta-per-minestre/alfabeto/,"Pastina","Agrispesa",2.23EUR,in stock,CERPASGDUROC19_2305_24172,,,,0,new,published,,,,,,,
CERFAR79_2303_24140,"Riso Vialone nano kg 1 integrale","Non facciamo mai concimazioni spinte delle risaie ma, dove possibile, applichiamo la tecnica degli erbai intercalari, lasciando nei campi lo sfalcio delle erbe autunnali come fertilizzante naturale. Per la coltivazione applichiamo il metodo della falsa semina: si allagano le risaie per consentire la nascita delle infestanti, poi erpicate. Quest'operazione si ripete almeno due volte; quindi si procede alla semina del riso, precedentemente messo a bagno per farlo ben germogliare, e si allaga la risaia tenendo un livello dell'acqua molto alto. Il prodotto raccolto si chiama risone o greggio e viene passato al bramino, per asportare la lolla e ottenere così il riso integrale. Dal bramino passa alle macchine sbiancatrici che asportano la pula e lasciano il semilavorato da cui si ottiene poi il riso bianco. Non effettuiamo la brillatura (aggiunta di oli essenziali).La trasformazione avviene sempre in azienda con macchine tradizionali, in piccoli quantitativi per avere il prodotto sempre fresco. Riso Vialone nano integrale.Ingredienti: riso Vialone nano.Allergeni: confezionato in locale dove sono confezionate farine di GRANO.",https://agrispesa.loc/wp-content/uploads/2023/02/default-300x300.png,https://agrispesa.loc/negozio/riso-vialone-nano-2/,"Riso, Negozio","Agrispesa",7.57EUR,in stock,CERFAR79_2303_24140,,,,0,new,published,,,,,,,
CERRIS29_2303_24145,"Riso rosso S. Eusebio kg 1 semilavorato","Il riso rosso S. Eusebio è una particolare varietà di riso (Japonica) comparsa spontaneamente. Nella mia lunga vita di agricoltore ho vissuto anche esperienze di grande interesse. Alla fine degli anni ottanta, in un campo dove stavo effettuando una selezione massale, individuai una pianta con una pannocchia strana. Provando a sgranarla, non crodava (non si staccava dalla pianta sbriciolandosi) e aveva un colore rosso molto particolare. Provai a riseminarla e notai che manteneva la purezza varietale e così, dopo 4-5 anni di prove, decisi di fare analizzare quel riso all'Ente risi per valutarne le qualità. I risultati lasciarono tutti stupefatti. Era un riso ricco di nutrienti, una vera miniera di antiossidanti e di ferro altamente assimilabile. Alcuni anni dopo vennero anche alcuni ricercatori dell'università di Parma da noi in azienda a prelevare dei campioni: le loro analisi confermarono le proprietà del Riso rosso S. Eusebio che avevo accudito. 
  
  Per la coltivazione del riso rosso S. Eusebio applichiamo il metodo della falsa semina: si allargano le risaie per consentire la nascita delle infestanti, poi erpicate. Questa operazione si ripete almeno due volte; quindi si procede alla semina del riso, precedentemente messo a bagno per farlo ben germogliare, e si allaga la risaia tenendo un livello dell'acqua molto alto.
  
  Il prodotto raccolto si chiama risone o greggio e viene stoccato. Viene passato al bramino, dove si effettua la sbramatura che asporta la lolla, la parte non commestibile: in questo modo si ottiene il riso integrale. Da noi, a Cascina Canta, non si effettua la brillatura (che prevede l’aggiunta di oli essenziali). La trasformazione avviene sempre in azienda con macchine tradizionali, in piccoli quantitativi per avere il prodotto sempre fresco.
  
  A chicco medio lungo, il riso rosso S. Eusebio si può cucinare in tutti i modi ma è consigliabile assaporarlo bollito e condito con olio extravergine di oliva o burro. Consumare questo riso, soprattutto se integrale, è un bene anche per la salute per il suo potere antiossidante, dovuto ad un'alta presenza di polifenoli. Inoltre, è molto ricco di ferro.",https://agrispesa.loc/wp-content/uploads/2023/02/default-300x300.png,https://agrispesa.loc/negozio/riso-rosso-s-eusebio/,"Riso, Negozio","Agrispesa",7.35EUR,in stock,CERRIS29_2303_24145,,,,0,new,published,,,,,,,
CERRIS30_2303_24146,"Riso rosso S. Eusebio kg 1 integrale","Il riso rosso S. Eusebio è una particolare varietà, la Japonica, comparsa spontaneamente. Nella mia lunga vita di agricoltore ho vissuto anche esperienze di grande interesse. Alla fine degli anni ottanta, in un campo dove stavo effettuando una selezione massale, individuai una pianta con una pannocchia strana. Provando a sgranarla, non crodava (non si staccava dalla pianta sbriciolandosi) e aveva un colore rosso molto particolare. Provai a riseminarla e notai che manteneva la purezza varietale e così, dopo 4-5 anni di prove, decisi di farla analizzare all'Ente risi per valutarne le qualità. I risultati lasciarono tutti stupefatti. Era ricco di nutrienti, una vera miniera di antiossidanti e di ferro altamente assimilabile. Alcuni anni dopo vennero anche alcuni ricercatori dell'università di Parma da noi in azienda a prelevare dei campioni: le loro analisi confermarono le proprietà del riso rosso S. Eusebio che avevo accudito. 
  
  Per la coltivazione del riso rosso S. Eusebio applichiamo il metodo della falsa semina: si allargano le risaie per consentire la nascita delle infestanti, poi erpicate. Questa operazione si ripete almeno due volte; successivamente si procede alla semina dei chicchi, che nel frattempo erano stati messi a bagno per farli ben germogliare, e si allaga la risaia tenendo un livello dell'acqua molto alto.
  
  Il prodotto raccolto si chiama risone o greggio e viene stoccato. Viene passato al bramino, dove si effettua la sbramatura che asporta la lolla, la parte non commestibile: in questo modo si ottiene il cereale integrale. Da noi, a Cascina Canta, non si effettua la brillatura (che prevede l’aggiunta di oli essenziali). La trasformazione avviene sempre in azienda con macchine tradizionali, in piccoli quantitativi per avere il prodotto sempre fresco.
  
  A chicco medio lungo, il riso rosso S. Eusebio si può cucinare in tutti i modi, ma è consigliabile assaporarlo bollito e condito con olio extravergine di oliva o burro. Consumare il riso rosso S. Eusebio integrale, è un bene anche per la salute per il suo potere antiossidante, dovuto ad un'alta presenza di polifenoli. Inoltre, è molto ricco di ferro.
  
  La cottura di base di tutti i cereali in chicco avviene per assorbimento. Questo significa che si calcola la quantità di acqua corretta affinché a fine cottura venga completamente assorbita e non sia necessario scolare, evitando di perdere preziosi nutrienti. Nel caso del riso rosso S. Eusebio integrale la quantità di acqua necessaria è circa doppia rispetto al volume del cereale. 
  
  In pratica significa che misurando una tazza di riso, occorreranno 2 tazze abbondanti di acqua. Durante la cottura non è necessario mescolare, anzi, è sconsigliato. La cottura va dai 40 ai 50 minuti. Una volta spenta la fiamma, è bene lasciare il riso rosso S. Eusebio integrale coperto a riposare per circa 10 minuti. Una volta cotto, dura in frigorifero 4-5 giorni.",https://agrispesa.loc/wp-content/uploads/2023/02/default-300x300.png,https://agrispesa.loc/negozio/riso-rosso-s-eusebio-2/,"Riso, Negozio","Agrispesa",7.35EUR,in stock,CERRIS30_2303_24146,,,,0,new,published,,,,,,,
CERRIS31_2303_24147,"Riso Carnaroli kg 1 integrale","Il Riso Carnaroli è un riso originario della zona tra Vercelli, Novara e Pavia. Impiega 160 giorni dalla semina a completa maturazione ed è considerato uno dei migliori risi italiani.  Cottura: 50 minuti, ideale per insalate e risotti.Ingredienti: riso Carnaroli integrale.Allergeni: confezionato in locale dove sono confezionate farine di GRANO.Prodotto confezionato in atmosfera protettiva.",https://agrispesa.loc/wp-content/uploads/2023/02/default-300x300.png,https://agrispesa.loc/negozio/riso-carnaroli-3/,"Riso, Negozio","Agrispesa",7.57EUR,in stock,CERRIS31_2303_24147,,,,0,new,published,,,,,,,
CERRIS32_2303_24148,"Riso Carnaroli kg 1 semilavorato","Il Riso Carnaroli è un riso originario della zona tra Vercelli, Novara e Pavia. Impiega 160 giorni dalla semina a completa maturazione ed è considerato uno dei migliori risi italiani. È un riso dal chicco lungo che tiene bene la cottura. Ideale per i risotti. Ingredienti: riso Carnaroli semilavorato.Allergeni: confezionato in locale dove sono confezionate farine di GRANO.Prodotto confezionato in atmosfera protettiva.",https://agrispesa.loc/wp-content/uploads/2023/02/default-300x300.png,https://agrispesa.loc/negozio/riso-carnaroli-2/,"Riso, Negozio","Agrispesa",7.57EUR,in stock,CERRIS32_2303_24148,,,,0,new,published,,,,,,,
FORVAFRE60_2246_24156,"Burro g 125","Il nostro è un burro di centrifuga, mentre il 90% del burro che si trova in giro è di affioramento. Il burro dovrebbe essere solo da centrifuga e da panna fresca. Noi quando scremiamo il latte, la panna viene messa via in frigo, lasciata maturare e quindi centrifugata dopodiché viene lavorata nell'acqua gelata a mano e così facciamo le forme. Il colore varia in base alla stagione, giallo più tenue in inverno, giallo più intenso nella stagione primaverile estiva, perché le erbe sono in piena fioritura e questa cosa si trasmette nel latte. E' un burro completamente naturale perché la panna è il nostro latte e nient’altro. Affinché il burro possa 'respirare', utilizziamo una carta compostabile. Modalità di conservazione: conservare in frigorifero a temperature da +1 a +6°C.Burro.Ingredienti: LATTE vaccino.Allergeni. Contiene LATTE.",https://agrispesa.loc/wp-content/uploads/2023/02/default-300x300.png,https://agrispesa.loc/negozio/burro-2/,"Burro, latte e uova, Negozio","Agrispesa",7.54EUR,in stock,FORVAFRE60_2246_24156,,,,0,new,published,,,,,,,
CERFAR38_2303_24136,"Riso Vialone nano kg 1 semilavorato","Non facciamo mai concimazioni spinte delle risaie ma, dove possibile, applichiamo la tecnica degli erbai intercalari, lasciando nei campi lo sfalcio delle erbe autunnali come fertilizzante naturale. Per la coltivazione applichiamo il metodo della falsa semina: si allagano le risaie per consentire la nascita delle infestanti, poi erpicate. Quest'operazione si ripete almeno due volte; quindi si procede alla semina del riso, precedentemente messo a bagno per farlo ben germogliare, e si allaga la risaia tenendo un livello dell'acqua molto alto. Il prodotto raccolto si chiama risone o greggio e viene passato al bramino, per asportare la lolla e ottenere così il riso integrale. Dal bramino passa alle macchine sbiancatrici che asportano la pula e lasciano il semilavorato da cui si ottiene poi il riso bianco. Non effettuiamo la brillatura (aggiunta di oli essenziali).La trasformazione avviene sempre in azienda con macchine tradizionali, in piccoli quantitativi per avere il prodotto sempre fresco.Il Vialone nano semilavorato si caratterizza per il chicco medio tondo. E' un tipo di riso ideale per tutti i tipi di risotti.  Cottura: 18 minuti.Riso Vialone nano semilavoratoIngredienti: riso Vialone nano.Allergeni: confezionato in locale dove sono confezionate farine di GRANO.",https://agrispesa.loc/wp-content/uploads/2023/02/default-300x300.png,https://agrispesa.loc/negozio/riso-vialone-nano/,"Riso, Negozio","Agrispesa",7.57EUR,in stock,CERFAR38_2303_24136,,,,0,new,published,,,,,,,
