id,title,description,image_link,link,product_type,brand,price,availability,item_group_id,checkout_url,additional_image_link,sale_price_effective_date,sale_price,condition,visibility,gender,color,size,pattern,google_product_category,default_product,variant
SALCACCIATORIN1_2337_47605,"Salamino tradizionale g 200","Il salamino tradizionale è un salame crudo, insaccato in budello naturale e stagionato lentamente.
  
Consiglio di portarlo a temperatura ambiente almeno un'ora prima di gustarlo. Affetta il salamino tradizionale a mano e gustalo al naturale, oppure accompagnalo con una fetta di pane casereccio.
  
Il maiale che vive all’aperto può grufolare liberamente. Libero di muoversi, infila il naso sottoterra, cerca i vermi, si corica nelle pozze di acqua. I maiali hanno una vita sociale che li porta a muoversi in gruppo e, in inverno, stanno tutti vicini vicini per riscaldarsi. Quando arriva un maiale nuovo si studiano per decidere che ruolo avrà il nuovo arrivato all’interno della gerarchia del gruppo. I maiali che stanno all’aperto, anche a -10°, non danno mai un colpo di tosse, non si ammalano mai. 
  
Noi compriamo maiali di 100 kg e poi li alleviamo; li portiamo fino a 200-250 kg, quindi li teniamo ancora 6-7 mesi. Facciamo la parte di ingrasso all’aperto. I maiali li compriamo da un’azienda che non fa il taglio della coda: sono della classica razza bianca, il maiale rosa. 
  
Come cibo diamo cereali. In più possono trovare nel terreno frutti o altrimenti erba, radici, insetti perché sono onnivori. Se avvertono un pericolo, anche solo se arrivo facendo un po’ più rumore del solito e non mi riconoscono, se hanno una qualche paura di qualcosa, fanno il loro verso, il grugnito, molto forte e tutti alzano le orecchie, stanno all’erta e tendono a scappare.",https://agrispesa.loc/wp-content/uploads/2023/02/default-300x300.png,https://agrispesa.loc/negozio/carne-pesce/affettati-e-salumi-carne-pesce/salamino-tradizionale-g-200/,"Salumi e affettati","Agrispesa",8.88EUR,in stock,SALCACCIATORIN1_2337_47605,,,,0,new,published,,,,,,,
PEPERONIALF1_2249_47603,"Peperoni al forno g 250","Peperoni al forno g 250",https://agrispesa.loc/wp-content/uploads/2023/02/default-300x300.png,https://agrispesa.loc/negozio/verdura/pomodori/peperoni-al-forno-g-250/,"Pomodori e peperoni, Verdure","Agrispesa",6EUR,in stock,PEPERONIALF1_2249_47603,,,,0,new,published,,,,,,,
FORCASEMISTAG20_2337_47596,"Ciabot g 200","Formaggio stagionato minimo 20 giorni.
Ingredienti: latte crudo di capra, fermenti, caglio, sale.",https://agrispesa.loc/wp-content/uploads/2023/02/default-300x300.png,https://agrispesa.loc/negozio/latticini/caprini-semistagionati/ciabot-g-200/,"Caprini semistagionati","Agrispesa",7.59EUR,in stock,FORCASEMISTAG20_2337_47596,,,,0,new,published,,,,,,,
FORCAFRE45_2337_47595,"Primo sale di capra g 350","Ingredienti: latte crudo di capra, caglio, sale.",https://agrispesa.loc/wp-content/uploads/2023/02/default-300x300.png,https://agrispesa.loc/negozio/latticini/caprini-freschi/primo-sale-di-capra-g-350/,"Caprini freschi","Agrispesa",9.45EUR,in stock,FORCAFRE45_2337_47595,,,,0,new,published,,,,,,,
FORCAFRE44_2337_47594,"Ricotta di capra g 200","Ingredienti: siero di latte di capra.",https://agrispesa.loc/wp-content/uploads/2023/02/default-300x300.png,https://agrispesa.loc/negozio/latticini/caprini-freschi/ricotta-di-capra-g-200/,"Caprini freschi","Agrispesa",4.08EUR,in stock,FORCAFRE44_2337_47594,,,,0,new,published,,,,,,,
CERFAR103_2337_47590,"Farina di mais antichi kg 1","Cascina Danesa è di proprietà del ramo materno della nostra famiglia da generazioni – racconta Claudio Priotti, titolare insieme al fratello Paolo, dell’azienda agricola Cascina Danesa a Bibiana (To). I nostri nonni erano agricoltori e questa terra dava loro il necessario per vivere. I nostri genitori hanno fatto scelte di vita differenti e pensavano di utilizzare la cascina come casa di campagna e come luogo dove trascorrere gli anni della pensione. La morte prematura di nostro padre, 10 anni fa, ha portato a dover cambiare i piani. In quegli anni io svolgevo un lavoro come impiegato che non mi soddisfaceva e mio fratello stentava a trovar sbocchi lavorativi con la sua una laurea in scienze forestali e così, quasi per gioco, abbiamo iniziato a produrre le prime bottiglie di succo di mela, di sidro e di aceto di mele.

Oggi nei nostri frutteti coltiviamo 21 varietà di mele, 7 varietà di pere, piccoli frutti e ortaggi con certificazione biologica. Nel 2014, accanto alla produzione frutticola, abbiamo iniziato a coltivare cereali antichi, grano senatore Cappelli in particolare, e canapa da seme, che abbiamo introdotto per la necessità di avere un’altra coltivazione per ruotare le colture.

La farina di mais è fatta da un misto di mais antichi: 3 tipi di pignoletto, 2 tipi di ottofile, nostrano dell'isola, sostenga bianco ed un mais viola messicano. La facciamo macinata a pietra, grossolana, dall'intenso sapore.",https://agrispesa.loc/wp-content/uploads/2023/02/default-300x300.png,https://agrispesa.loc/negozio/pane-cereali/farine-varie/farina-di-mais-antichi-kg-1/,"Farine varie","Agrispesa",6.06EUR,in stock,CERFAR103_2337_47590,,,,0,new,published,,,,,,,
CERFAR105_2337_47591,"Farina di ceci kg 1","Gli attuali due ettari sono coltivati con i metodi dell’agricoltura biologica (ccpb).

Dai nostri alberi raccogliamo mele, pere e ciliegie, mentre un’area è dedicata ai piccoli frutti; mirtilli, more, lamponi e ribes.

È nostra cura tenere l’orto ben rifornito di zucchine, melanzane, patate, verze, zucche, pomodori, piselli, fagioli, cipolle, carote, etc.

L’ Azienda possiede una compostaia per l’autoproduzione di concime organico, il quale viene integrato, al bisogno, con letame maturo da allevamenti attenti al benessere degli animali.

Trasformiamo parte delle materie prime in succhi, aceti e sidri.

Farina di ceci ottima per preparazioni dolci e salate. 
Ceci coltivati in azienda senza l'uso della chimica. Macinata a pietra.",https://agrispesa.loc/wp-content/uploads/2023/02/default-300x300.png,https://agrispesa.loc/negozio/pane-cereali/farine-varie/farina-di-ceci-kg-1/,"Farine varie","Agrispesa",9.38EUR,in stock,CERFAR105_2337_47591,,,,0,new,published,,,,,,,
CARRMTRITATA1_2327_47589,"Polpa di maiale g 250 da sugo e polpette","Il maiale che vive all’aperto può grufolare liberamente. Libero di muoversi, infila il naso sottoterra, cerca i vermi, si corica nelle pozze di acqua. I maiali hanno una vita sociale che li porta a muoversi in gruppo e, in inverno, stanno tutti vicini vicini per riscaldarsi. Quando arriva un maiale nuovo si studiano per decidere che ruolo avrà il nuovo arrivato all’interno della gerarchia del gruppo.

I maiali che stanno all’aperto, anche a -10°, non danno mai un colpo di tosse, non si ammalano mai. Noi compriamo maiali di 100 kg e poi li alleviamo; li portiamo fino a 200-250 kg, quindi li teniamo ancora 6-7 mesi. Facciamo la parte di ingrasso all’aperto. I maiali li compriamo da un’azienda che non fa il taglio della coda: sono della classica razza bianca, il maiale rosa.

Come cibo diamo cereali. In più possono trovare nel terreno frutti o altrimenti erba, radici, insetti perché sono onnivori. Se avvertono un pericolo, anche solo se arrivo facendo un po’ più rumore del solito, e non mi riconoscono, se hanno una qualche paura di qualcosa, fanno il loro verso, il grugnito, molto forte e tutti alzano le orecchie, stanno all’erta e tendono a scappare.",https://agrispesa.loc/wp-content/uploads/2023/02/default-300x300.png,https://agrispesa.loc/negozio/carne-pesce/maiale/polpa-di-maiale-g-250-da-sugo-e-polpette/,"Maiale","Agrispesa",6.15EUR,in stock,CARRMTRITATA1_2327_47589,,,,0,new,published,,,,,,,
CARRMCAPOCINTE1_2337_47587,"Capocollo di maiale g 800 pezzo intero","Il capocollo di maiale si ricava dal collo dell’animale ed è una carne venata di grasso. Il capocollo di maiale è ideale per arrosti, che risultano morbidi e saporiti.
  
Noi compriamo maiali di 100 kg e poi li alleviamo; li portiamo fino a 200-250 kg, quindi li teniamo ancora 6-7 mesi. Facciamo la parte di ingrasso all’aperto. I maiali li compriamo da un’azienda che non fa il taglio della coda: sono della classica razza bianca, il maiale rosa. 

Il maiale è un animale molto intelligente, tende a non essere solitario, ma a rimanere in gruppo. Quando io compro dei nuovi gruppi si instaura un po’ di rivalità per i primi 4-5 giorni, ma poi decidono loro, il più forte comanda, l’altro capisce che deve mangiare dopo, prima mangiano i più forti. Il più forte non è detto che sia sempre un maschio, è sempre il più grande, quello più forte, ma a volte può anche essere una femmina. 
  
Come cibo diamo cereali. In più possono trovare nel terreno frutti o altrimenti erba, radici, insetti perché sono onnivori. Se avvertono un pericolo, anche solo se arrivo facendo un po’ più rumore del solito e non mi riconoscono, se hanno una qualche paura di qualcosa, fanno il loro verso, il grugnito, molto forte e tutti alzano le orecchie, stanno all’erta e tendono a scappare. 
  
Quindi comunicano con un linguaggio gestuale e vocale. 
  
In azienda abbiamo fatto tutta una serie di azioni per la sostenibilità ambientale: il fotovoltaico, la fitodepurazione, il solare termico, il recupero calore dai frigoriferi. Il calore che recuperiamo dai frigoriferi preriscalda l’acqua della caldaia che serve per la cottura e per i lavaggi. La fitodepurazione, invece, viene applicata sulle acque reflue che invece di andare in fognatura vengono depurate grazie all’azione delle canne palustri, che hanno la caratteristica di trasmettere tanto ossigeno alle radici, quindi sulle radici vengono a formarsi i batteri che depurano l’acqua. L’acqua così depurata va a finire nel rio, in acque superficiali.",https://agrispesa.loc/wp-content/uploads/2023/02/default-300x300.png,https://agrispesa.loc/negozio/carne-pesce/maiale/capocollo-di-maiale-g-800-pezzo-intero/,"Maiale","Agrispesa",19.01EUR,in stock,CARRMCAPOCINTE1_2337_47587,,,,0,new,published,,,,,,,
CARRMCOSTINE1_2337_47588,"Costine di maiale g 500","Ricaviamo le costine di maiale dalla cassa toracica dell’animale. Sono ottime alla griglia, ma anche in forno. Si accompagnano egregiamente ad ogni verdura grigliata, lessa o in insalata.
  
Il mio grande sogno, adesso non è ancora così, è arrivare ad avere una scrofaia dove nascono i maiali e io divento autosufficiente con 100% delle mie carni che arrivano da maiali allevati all’aperto a Ferrere, in Piemonte, che mangiano con cereali della zona. Questo è un po’ il mio obiettivo finale. 
  
Ci vorranno un po’ di anni. Ho una cascina con della terra e adesso la sto sistemando, c’è già una struttura, una stalla vecchia dentro. Per me son tutte cose nuove, anche l’allevamento all’aperto in una cascina con dei boschi non è che sia molto sviluppato in Italia, quindi bisogna fare un bel recinto e per me è tutta esperienza che mi devo fare. 
  
Inizierò con mettere 50 maiali, poi man mano aumento, spero fra due anni di averne 200 all’aperto poi da lì crescere. La stalla è il ricovero che bisogna comunque avere. L’idea è che in questo modo il prodotto sarà ulteriormente qualificato. Se il maiale sta all’aperto e mangia OGM free, il prodotto ha una marcia in più. In Piemonte qualcosa del genere non c’è. 
  
La carne dei maiali allevati all’aperto è senz’altro più consistente. Ho partecipato ad un progetto con un’universitaria a Grugliasco per una tesi sui conservanti, vediamo se riusciamo ad accedere a un bando e avere dei finanziamenti per cercare la quantità di Omega 3 presenti nelle carni nell’allevamento all’aperto.",https://agrispesa.loc/wp-content/uploads/2023/02/default-300x300.png,https://agrispesa.loc/negozio/carne-pesce/maiale/costine-di-maiale-g-500/,"Maiale","Agrispesa",8.99EUR,in stock,CARRMCOSTINE1_2337_47588,,,,0,new,published,,,,,,,
CARRMCAPOCFETT1_2337_47586,"Capocollo di maiale g 250 a fette","Il capocollo di maiale a fette si ricava dal collo dell’animale ed è una carne venata di grasso. Le fette di capocollo di maiale cuociono in tempo breve e si prestano bene sia a cotture alla griglia, che ad essere impanate. Le caratteristiche delle fette di capocollo di maiale sono proprio la morbidezza finale della carne cucinata ed il suo sapore vivace.
  
Noi compriamo maiali di 100 kg e poi li alleviamo; li portiamo fino a 200-250 kg, quindi li teniamo ancora 6-7 mesi. Facciamo la parte di ingrasso all’aperto. I maiali li compriamo da un’azienda che non fa il taglio della coda: sono della classica razza bianca, il maiale rosa. 
  
Il maiale è un animale molto intelligente, tende a non essere solitario, ma a rimanere in gruppo. Quando io compro dei nuovi gruppi si instaura un po’ di rivalità per i primi 4-5 giorni, ma poi decidono loro, il più forte comanda, l’altro capisce che deve mangiare dopo, prima mangiano i più forti. Il più forte non è detto che sia sempre un maschio, è sempre il più grande, quello più forte, ma a volte può anche essere una femmina. 
  
Come cibo diamo cereali. In più possono trovare nel terreno frutti o altrimenti erba, radici, insetti perché sono onnivori. Se avvertono un pericolo, anche solo se arrivo facendo un po’ più rumore del solito e non mi riconoscono, se hanno una qualche paura di qualcosa, fanno il loro verso, il grugnito, molto forte e tutti alzano le orecchie, stanno all’erta e tendono a scappare. 
  
  Quindi comunicano con un linguaggio gestuale e vocale. 
  
  In azienda abbiamo fatto tutta una serie di azioni per la sostenibilità ambientale: il fotovoltaico, la fitodepurazione, il solare termico, il recupero calore dai frigoriferi. Il calore che recuperiamo dai frigoriferi preriscalda l’acqua della caldaia che serve per la cottura e per i lavaggi. La fitodepurazione, invece, viene applicata sulle acque reflue che invece di andare in fognatura vengono depurate grazie all’azione delle canne palustri, che hanno la caratteristica di trasmettere tanto ossigeno alle radici, quindi sulle radici vengono a formarsi i batteri che depurano l’acqua. L’acqua così depurata va a finire nel rio, in acque superficiali.",https://agrispesa.loc/wp-content/uploads/2023/02/default-300x300.png,https://agrispesa.loc/negozio/carne-pesce/maiale/capocollo-di-maiale-g-250-a-fette/,"Maiale","Agrispesa",5.94EUR,in stock,CARRMCAPOCFETT1_2337_47586,,,,0,new,published,,,,,,,
CARRMBRACIOLE1_2337_47585,"Braciole di maiale g 250","Le braciole di maiale si ricavano dal carrè dell’animale, la loro è una carne mista, con zone magre e con venature di grasso. Le braciole di maiale cuociono in tempo breve e si prestano bene a cotture alla griglia, unitamente a salsiccia e a verdure di ogni tipo.
  
  Noi compriamo maiali di 100 kg e poi li alleviamo; li portiamo fino a 200-250 kg, quindi li teniamo ancora 6-7 mesi. Facciamo la parte di ingrasso all’aperto. I maiali li compriamo da un’azienda che non fa il taglio della coda, è un’azienda agricola che ha le scrofe e lavorano bene, a Borgaro Torinese: sono della classica razza bianca, il maiale rosa. 
  
  Il maiale è un animale molto intelligente, tende a non essere solitario ma a rimanere in gruppo. Quando io compro dei nuovi gruppi si instaura un po’ di rivalità per i primi 4-5 giorni ma poi decidono loro, il più forte comanda, l’altro capisce che deve mangiare dopo, prima mangiano i più forti; diventano tutti parte dello stesso gruppo dopo qualche giorno. Il più forte non è detto che sia sempre un maschio, è sempre il più grande, quello più forte, ma a volte può anche essere una femmina. 
  
  Come cibo diamo cereali. Abbiamo un mangimificio che con una nostra ricetta ci fa il mix di cereali e mangiano quello. In più possono trovare nel terreno frutti o altrimenti erba, radici, insetti perché sono onnivori. Se avvertono un pericolo, anche solo se arrivo facendo un po’ più rumore del solito e non mi riconoscono, se hanno una qualche paura di qualcosa, fanno il loro verso, il grugnito molto forte e tutti alzano le orecchie, stanno all’erta e tendono a scappare. 
  
  Quindi comunicano con un mix di linguaggio gestuale e vocale. 
  
  In azienda abbiamo fatto tutta una serie di azioni per la sostenibilità ambientale: il fotovoltaico, la fitodepurazione, il solare termico, il recupero calore dai frigoriferi. Il calore che recuperiamo dai frigoriferi preriscalda l’acqua della caldaia che serve per la cottura e per i lavaggi. La fitodepurazione, invece, viene applicata sulle acque reflue che invece di andare in fognatura vengono depurate grazie all’azione delle piante. Le piante sono delle canne palustri, è una canna particolare che ha la caratteristica di trasmettere tanto ossigeno alle radici, quindi sulle radici vengono a formarsi i batteri che depurano l’acqua. L’acqua così depurata va a finire nel rio, in acque superficiali. 
  In questo caso abbiamo piantato le piante una decina di anni fa, sembra che muoiano d’inverno, ma è solo la parte vegetativa sopra l’acqua che muore, rimangono attive le radici che continuano a trasmettere l’ossigeno, a depurare e tutte le primavere la piantina rinasce molto vigorosa perché vive benissimo, infatti la nostra acqua ha una carica organica molto importante e la pianta cresce molto rigogliosa.",https://agrispesa.loc/wp-content/uploads/2023/02/default-300x300.png,https://agrispesa.loc/negozio/carne-pesce/maiale/braciole-di-maiale-g-250/,"Maiale","Agrispesa",5.49EUR,in stock,CARRMBRACIOLE1_2337_47585,,,,0,new,published,,,,,,,
CARMSVIZ1_2337_47584,"Svizzere di maiale g 240 confezione da 2","Le svizzere di maiale possono essere cotte in padella senza aggiunta di grassi; per i più golosi possono essere ripiene di prosciutto e formaggio oppure panate.
  
  Il mio grande sogno è arrivare ad avere una scrofaia dove nascono i maiali e io divento autosufficiente con il 100% delle mie carni che arrivano da maiali allevati all’aperto a Ferrere, in Piemonte, che mangiano con cereali della zona. Questo è il mio obiettivo finale, adesso non è ancora così, ci vorranno un po’ di anni. 
  
  Ho una cascina con della terra e adesso la sto sistemando, c’è già una struttura, una stalla vecchia dentro. Per me son tutte cose nuove, anche l’allevamento all’aperto in una cascina con dei boschi non è che sia molto sviluppato in Italia.
  
  Inizierò con mettere 50 maiali, spero fra due anni di averne 200 all’aperto poi da lì crescere. La stalla è il ricovero che bisogna comunque avere. L’idea è che in questo modo il prodotto sarà ulteriormente qualificato. Se il maiale sta all’aperto e mangia ogm free, il prodotto ha una marcia in più. In Piemonte qualcosa del genere non c’è. 
  
  La carne dei maiali allevati all’aperto, in questo caso le svizzere di maiale, è senz’altro più consistente. Ho partecipato ad un progetto con un’universitaria a Grugliasco per una tesi sui conservanti, vediamo se riusciamo ad accedere a un bando e avere dei finanziamenti per cercare la quantità di Omega 3 presenti nella carne di maiale nell’allevamento all’aperto.",https://agrispesa.loc/wp-content/uploads/2023/02/default-300x300.png,https://agrispesa.loc/negozio/carne-pesce/maiale/svizzere-di-maiale-g-240-confezione-da-2/,"Maiale","Agrispesa",5.9EUR,in stock,CARMSVIZ1_2337_47584,,,,0,new,published,,,,,,,
CARMSTRACC1_2337_47583,"Straccetti di maiale g 250","Il mio grande sogno è arrivare ad avere una scrofaia dove nascono i maiali e io divento autosufficiente con il 100% delle mie carni che arrivano da maiali allevati all’aperto a Ferrere, in Piemonte, che mangiano con cereali della zona. Questo è il mio obiettivo finale, adesso non è ancora così. Ci vorranno un po’ di anni. 
  
Ho una cascina con della terra e adesso la sto sistemando, c’è già una struttura, una stalla vecchia dentro. Per me son tutte cose nuove, anche l’allevamento all’aperto in una cascina con dei boschi non è che sia molto sviluppato in Italia.
  
Inizierò con mettere 50 maiali, spero fra due anni di averne 200 all’aperto poi da lì crescere. La stalla è il ricovero che bisogna comunque avere. L’idea è che in questo modo il prodotto sarà ulteriormente qualificato. Se il maiale sta all’aperto e mangia ogm free, il prodotto ha una marcia in più. In Piemonte qualcosa del genere non c’è. 
  
La carne dei maiali allevati all’aperto è senz’altro più consistente. Ho partecipato ad un progetto con un’universitaria a Grugliasco per una tesi sui conservanti, vediamo se riusciamo ad accedere a un bando e avere dei finanziamenti per cercare la quantità di Omega 3 presenti nella carne di maiale negli allevamenti all’aperto.",https://agrispesa.loc/wp-content/uploads/2023/02/default-300x300.png,https://agrispesa.loc/negozio/carne-pesce/maiale/straccetti-di-maiale-g-250/,"Maiale","Agrispesa",7.51EUR,in stock,CARMSTRACC1_2337_47583,,,,0,new,published,,,,,,,
CARMLONZAFETTE1_2337_47581,"Lonza di maiale a fette g 250","Il maiale che vive all’aperto può grufolare liberamente. Libero di muoversi, infila il naso sottoterra, cerca i vermi, si corica nelle pozze di acqua. I maiali hanno una vita sociale che li porta a muoversi in gruppo e, in inverno, stanno tutti vicini vicini per riscaldarsi. Quando arriva un nuovo animale si studiano per decidere che ruolo avrà il nuovo arrivato all’interno della gerarchia del gruppo.

I maiali che stanno all’aperto, anche a -10°, non danno mai un colpo di tosse, non si ammalano mai.

Trovano il loro cibo in grandi contenitori: prepariamo per loro mais, orzo, pisello proteico e crusca tutti ogm free. In più possono trovare nel terreno frutti o altrimenti erba, radici, insetti perché sono onnivori.",https://agrispesa.loc/wp-content/uploads/2023/02/default-300x300.png,https://agrispesa.loc/negozio/carne-pesce/maiale/lonza-di-maiale-a-fette-g-250/,"Maiale","Agrispesa",7.51EUR,in stock,CARMLONZAFETTE1_2337_47581,,,,0,new,published,,,,,,,
CARMLONZAINTER1_2337_47582,"Lonza di maiale g 800 pezzo intero","Il maiale che vive all’aperto può grufolare liberamente. Libero di muoversi, infila il naso sottoterra, cerca i vermi, si corica nelle pozze di acqua. I maiali hanno una vita sociale che li porta a muoversi in gruppo e, in inverno, stanno tutti vicini vicini per riscaldarsi. Quando arriva un maiale nuovo si studiano per decidere che ruolo avrà il nuovo arrivato all’interno della gerarchia del gruppo. I maiali che stanno all’aperto, anche a -10°, non danno mai un colpo di tosse, non si ammalano mai. Trovano il loro cibo in grandi contenitori: prepariamo per loro mais, orzo, pisello proteico e crusca tutti ogm free.Detta anche carrè o arista, la lonza di maiale (pezzo intero) è un taglio particolarmente magro, indicato anche nelle diete ipocaloriche. Si presta in particolare alla cottura arrosto o al forno. Avvolgendola con pancetta o lardo, la carne rimane più morbida così come se viene cucinata con il latte. In alternativa può essere tagliata a fettine e poi cotta ai ferri, in padella o usata per le scaloppine.  Modalità di conservazione: conservare da 0°C a + 4°C.Da consumarsi previa cottura.Lonza di maiale.Codice di identificazione allevamento CE IT M8U63Allevato, macellato e sezionato in Italia.",https://agrispesa.loc/wp-content/uploads/2023/02/default-300x300.png,https://agrispesa.loc/negozio/carne-pesce/maiale/lonza-di-maiale-g-800-pezzo-intero/,"Maiale","Agrispesa",24.03EUR,in stock,CARMLONZAINTER1_2337_47582,,,,0,new,published,,,,,,,
CARMBOCCG500_2337_47580,"Bocconcini di maiale g 300","I bocconcini di maiale si ricavano dalla spalla dell’animale, la loro è una carne piuttosto magra.
I bocconcini di maiale cuociono in tempo breve e si prestano perciò a realizzare piatti saporiti anche all’ultimo momento.
  
Per quanto riguarda l’allevamento, il nostro lavoro è abbastanza costante, lavoriamo tutto l’anno, avendo i maiali all’aperto la stagione non ci cambia più di tanto. Noi compriamo maiali di 100 kg e poi li alleviamo; li portiamo fino a 200-250 kg, quindi li teniamo ancora 6-7 mesi. Facciamo la parte di ingrasso all’aperto. 
  
I maiali li compriamo da un’azienda che non fa il taglio della coda, è un’azienda agricola che ha le scrofe e lavorano bene, a Borgaro Torinese: sono della razza bianca, il maiale rosa. 
  
Il maiale è un animale molto intelligente, tende a non essere solitario, ma a rimanere in gruppo. Quando io compro dei nuovi gruppi si instaura un po’ di rivalità per i primi 4-5 giorni, ma poi decidono loro, il più forte comanda, l’altro capisce che deve mangiare dopo, prima mangiano i più forti; diventano tutti parte dello stesso gruppo dopo qualche giorno. Il più forte non è detto che sia sempre un maschio, è sempre il più grande, quello più forte, ma a volte può anche essere una femmina. 
  
Come cibo diamo cereali. Abbiamo un mangimificio che con una nostra ricetta ci fa il mix di cereali e mangiano quello. In più possono trovare nel terreno frutti o altrimenti erba, radici, insetti perché sono onnivori. 
  
Se avvertono un pericolo, anche solo se arrivo facendo un po’ più rumore del solito, se hanno paura di qualcosa, fanno il loro verso, il grugnito molto forte e tutti alzano le orecchie, stanno all’erta e tendono a scappare. Quindi comunicano con una mescolanza di linguaggio gestuale e vocale.",https://agrispesa.loc/wp-content/uploads/2023/02/default-300x300.png,https://agrispesa.loc/negozio/carne-pesce/maiale/bocconcini-di-maiale-g-300/,"Maiale","Agrispesa",8.36EUR,in stock,CARMBOCCG500_2337_47580,,,,0,new,published,,,,,,,
