id,title,description,image_link,link,product_type,brand,price,availability,item_group_id,checkout_url,additional_image_link,sale_price_effective_date,sale_price,condition,visibility,gender,color,size,pattern,google_product_category,default_product,variant
CARBCFILETTI_2403_54579,"Filetto di coniglio g 250 a fette","I nostri conigli sono nutriti con razioni alimentari a base di cereali e foraggi prodotti nella nostra azienda. La loro alimentazione è costituita per oltre il 50% da fieno e da foraggi ottenuti dai prati di erba medica, la restante parte da cereali minori quali avena, segala, triticale. Utilizziamo rosmarino, bentonite, miele, olii derivati da essenze vegetali per migliorare ed equilibrare le razioni. Per la prevenzione delle malattie e il soddisfacimento dei fabbisogni di vitamine e minerali ci avvaliamo di estratti vegetali, oli essenziali e propoli e non utilizziamo mai antibiotici. Non pratichiamo forzature sulla riproduzione e sulla crescita, le fattrici partorisco in media 4 volte l'anno e i conigli raggiungono l'età di macellazione a circa 5 mesi (negli allevamenti intensivi, invece, si arrivano a ottenere più di 10 parti all'anno per fattrice e l'età di macellazione si abbassa a circa 75 giorni). 
Modalità di conservazione: conservare da 0°C a + 4°C
Da consumarsi previa cottura.

Filetti di coniglio.
Codice di identificazione allevamento IT 110TO086
Allevato, macellato e sezionato in Italia.",https://agrispesa.loc/wp-content/uploads/2023/02/default-300x300.png,https://agrispesa.loc/negozio/carne-pesce/coniglio-disossato/filetto-di-coniglio-g-250-a-fette/,"Coniglio senza osso","Agrispesa",12.04EUR,in stock,CARBCFILETTI_2403_54579,,,,0,new,published,,,,,,,
CARBCPORZ_2403_54580,"Coniglio porzionato kg 1 senza testa e senza fegato","La lavorazione del coniglio porzionato senza testa e senza fegato avviene direttamente all’interno della nostra azienda. In tal modo, oltre ad evitare agli animali gli stress dovuti al trasporto, si garantisce che la qualità del prodotto, in questo caso del coniglio porzionato, non subisca calo di livello in nessuna fase, fino ad arrivare al prodotto finito e alla messa in vendita. Il nostro allevamento è impostato con sistema non intensivo, in ambienti che rispettano il benessere degli animali. Le fattrici partorisco 4 volte l'anno e gli animali raggiungono l'età di macellazione a 5 mesi (negli allevamenti intensivi si arrivano a ottenere più di 10 parti all'anno per fattrice e l'età di macellazione si abbassa a circa 75 giorni). Con i cereali e i foraggi prodotti direttamente in azienda vengono preparate le varie razioni alimentari. Le coltivazioni prevedono l’utilizzo di fertilizzanti naturali prodotti nell’azienda e la pratica della rotazione delle colture. Per la prevenzione delle malattie e il soddisfacimento dei fabbisogni di vitamine e minerali ci avvaliamo di oli essenziali e propoli e non utilizziamo mai antibiotici'. Perché preferire la carne di coniglio? 1. È molto più digeribile di altre carni. Alcuni tempi di digeribilità: coniglio 2 h, pollo 2,5 h, vitello 3 h, maiale e uova sode 5 h. 2. Il potere nutritivo è notevole: 21,5 gr di proteine su 100 gr di prodotto. 3. Il contenuto in acidi grassi e colesterolo è molto basso: 30/35 mg per 100 di prodotto contro 70 mg per la carne di vitello e 125 mg per la carne di maiale. 4. Ha un contenuto d’acqua pari a circa 60% (mentre altre carni superano il 70%) con maggior resa nella cottura e quindi con convenienza economica. 5. È l’animale da allevamento che è meno in competizione con l’uomo per l’alimentazione. Infatti richiede, per la sua alimentazione, una percentuale molto inferiore di cereali, di leguminose e di altri prodotti utili anche all’uomo. 6. Un allevamento di questi animali ha un minore impatto ambientale.",https://agrispesa.loc/wp-content/uploads/2023/02/default-300x300.png,https://agrispesa.loc/negozio/carne-pesce/coniglio-con-osso/coniglio-porzionato-kg-1-senza-testa-e-senza-fegato/,"Coniglio con osso","Agrispesa",26.62EUR,in stock,CARBCPORZ_2403_54580,,,,0,new,published,,,,,,,
CARBCCOSCEANT_2403_54578,"Spallette di coniglio g 400","La lavorazione delle coscette di coniglio anteriori avviene direttamente all’interno della Società Agricola Aimone. In tal modo, oltre ad evitare agli animali gli stress dovuti al trasporto, si garantisce che la qualità del prodotto, in questo caso le coscette di coniglio anteriori, non subisca calo di livello in nessuna fase, fino ad arrivare al prodotto finito e alla messa in vendita. L’allevamento è impostato con sistema non intensivo, in ambienti che rispettano il benessere degli animali. Le fattrici partorisco 4 volte l'anno e gli animali raggiungono l'età di macellazione a 5 mesi (negli allevamenti intensivi si arrivano a ottenere più di 10 parti all'anno per fattrice e l'età di macellazione si abbassa a circa 75 giorni). Gli animali della Società Agricola Aimone sono nutriti con razioni a base di cereali e foraggi prodotti dall’azienda stessa: in questo modo si riduce l’inquinamento dovuto allo spostamento delle materie prime e si valorizzano le produzioni locali quali foraggi, segale e avena provenienti da terreni altrimenti destinati all’abbandono. Le coltivazioni prevedono l’utilizzo di fertilizzanti naturali prodotti nell’azienda e la pratica della rotazione delle colture. Con i cereali e foraggi prodotti direttamente vengono preparate in azienda le varie razioni alimentari. Per la prevenzione delle malattie e il soddisfacimento dei fabbisogni di vitamine e minerali ci avvaliamo di oli essenziali e propoli e non utilizziamo mai antibiotici'. Perché preferire la carne di coniglio? 1. È molto più digeribile di altre carni. Alcuni tempi di digeribilità: coniglio 2 h, pollo 2,5 h, vitello 3 h, maiale e uova sode 5 h. 2. Il potere nutritivo delle coscette di coniglio anteriori è notevole: 21,5 gr di proteine su 100 gr di prodotto. 3. Il contenuto in acidi grassi e colesterolo delle coscette di coniglio anteriori è molto basso: 30/35 mg per 100 di prodotto contro 70 mg per la carne di vitello e 125 mg per la carne di maiale. 4. Ha un contenuto d’acqua pari a circa 60% (mentre altre carni superano il 70%) con maggior resa nella cottura e quindi con convenienza economica. 5. È l’animale da allevamento che è meno in competizione con l’uomo per l’alimentazione. Infatti richiede, per la sua alimentazione, una percentuale molto inferiore di cereali, di leguminose e di altri prodotti utili anche all’uomo. 6. Un allevamento di questi animali ha un minore impatto ambientale.",https://agrispesa.loc/wp-content/uploads/2023/02/default-300x300.png,https://agrispesa.loc/negozio/carne-pesce/coniglio-con-osso/spallette-di-coniglio-g-400/,"Coniglio con osso","Agrispesa",11.52EUR,in stock,CARBCCOSCEANT_2403_54578,,,,0,new,published,,,,,,,
CARBCBOCCONCI_2403_54576,"Spezzatino di coniglio g 300 di coscia","I bocconcini di coniglio sono semplicissimi da cucinare. Trattandosi di sola polpa, i bocconcini di coniglio possono essere posti in padella solo con un filo di olio, fatti rosolare e portati a cottura con l’aggiunta di brodo vegetale. Così semplicemente realizzati, i bocconcini di coniglio possono accompagnare qualsiasi contorno di verdure, dal purè di patate, alla peperonata, ad un’insalata di verdure lesse o crude. Se invece si fanno lessare in acqua con carota, cipolla e sedano, i bocconcini di coniglio sono ottimi in insalata. Coperti con olio e sale e con l’aggiunta di una foglia di alloro, messi in frigo in una ciotola coperta, i bocconcini di coniglio saranno ancor più gustosi il giorno dopo. Nel delicato brodo di cottura dei bocconcini di coniglio, si potranno cuocere degli ottimi ravioli del plìn. La lavorazione dei bocconcini di coniglio avviene direttamente nella nostra azienda. Lavorare le carni nella stessa azienda nella quale sono allevati, oltrechè evitare agli animali gli stress dovuti al trasporto, garantisce che la qualità del prodotto, in questo caso i bocconcini di coniglio, non subisce calo di livello in nessuna fase, fino ad arrivare al prodotto finito e posto in vendita. L’allevamento è impostato con sistema non intensivo, senza forzature sulla riproduzione e sulla crescita, in ambienti che rispettano il benessere degli animali. Non pratichiamo forzature sulla riproduzione e sulla crescita, le fattrici partorisco in media 4 volte l'anno e i conigli raggiungono l'età di macellazione a circa 5 mesi (negli allevamenti intensivi, invece, si arrivano a ottenere più di 10 parti all'anno per fattrice e l'età di macellazione si abbassa a circa 75 giorni). Abbiamo sviluppato negli anni approfondite ricerche sull’alimentazione animale e sulla socialità dei conigli, da noi le madri rimangono con i loro piccoli fino a circa 60 giorni dal parto, quando i piccoli hanno abbondantemente superato l’età dello svezzamento vivendo sempre con la madre. I nostri conigli sono nutriti con razioni alimentari a base di cereali e foraggi prodotti dall’azienda stessa. Le coltivazioni prevedono l’utilizzo di fertilizzanti naturali prodotti nell’azienda e la pratica della rotazione delle colture. Con i cereali e foraggi prodotti direttamente vengono preparate in azienda le varie razioni alimentari. In questo modo viene anche ridotto notevolmente l’inquinamento dovuto allo spostamento delle materie prime e sono valorizzate le produzioni locali quali foraggi e cereali minori (segala, avena) provenienti da terreni precollinari altrimenti destinati all’abbandono. Per migliorare ed equilibrare le razioni alimentari utilizziamo rosmarino, bentonite, miele, olii derivati da essenze vegetali. Per la prevenzione delle malattie e il soddisfacimento dei fabbisogni di vitamine e minerali ci avvaliamo di estratti vegetali, oli essenziali e propoli e non utilizziamo mai antibiotici. I conigli allevati provengono da razze rustiche, che crescono di meno, ma sono più robuste. Questi animali usano le loro energie per affrontare le avversità (rusticità: capacità di sopportare condizioni avverse) e garantiscono una maggior resistenza alle malattie. Sono infatti le condizioni di benessere e di igiene a garantire la migliore prevenzione delle malattie ed una migliore qualità del prodotto.",https://agrispesa.loc/wp-content/uploads/2023/02/default-300x300.png,https://agrispesa.loc/negozio/carne-pesce/coniglio-disossato/spezzatino-di-coniglio-g-300-di-coscia/,"Coniglio senza osso","Agrispesa",13.43EUR,in stock,CARBCBOCCONCI_2403_54576,,,,0,new,published,,,,,,,
CARBCCOSCE_2403_54577,"Cosce di coniglio g 650 posteriori","La lavorazione delle cosce di coniglio posteriori avviene direttamente all’interno della nostra azienda. In tal modo, oltre ad evitare agli animali gli stress dovuti al trasporto, si garantisce che la qualità del prodotto, in questo caso le cosce di coniglio posteriori, non subisca calo di livello in nessuna fase, fino ad arrivare al prodotto finito e alla messa in vendita. Il nostro allevamento è impostato con sistema non intensivo, in ambienti che rispettano il benessere degli animali. Le fattrici partorisco 4 volte l'anno e gli animali raggiungono l'età di macellazione a 5 mesi (negli allevamenti intensivi si arrivano a ottenere più di 10 parti all'anno per fattrice e l'età di macellazione si abbassa a circa 75 giorni). I nostri animali sono nutriti con razioni a base di cereali e foraggi prodotti dall’azienda stessa: in questo modo si riduce l’inquinamento dovuto allo spostamento delle materie prime e si valorizzano le produzioni locali quali foraggi, segale e avena provenienti da terreni altrimenti destinati all’abbandono. Le coltivazioni prevedono l’utilizzo di fertilizzanti naturali prodotti nell’azienda e la pratica della rotazione delle colture. Con i cereali e foraggi prodotti direttamente vengono preparate in azienda le varie razioni alimentari. Per la prevenzione delle malattie e il soddisfacimento dei fabbisogni di vitamine e minerali ci avvaliamo di oli essenziali e propoli e non utilizziamo mai antibiotici'. Perché preferire la carne di coniglio? 1. È molto più digeribile di altre carni. Alcuni tempi di digeribilità: coniglio 2 h, pollo 2,5 h, vitello 3 h, maiale e uova sode 5 h. 2. Il potere nutritivo è notevole: 21,5 gr di proteine su 100 gr di prodotto. 3. Il contenuto in acidi grassi e colesterolo delle Cosce di coniglio posteriori è molto basso: 30/35 mg per 100 di prodotto contro 70 mg per la carne di vitello e 125 mg per la carne di maiale. 4. Ha un contenuto d’acqua pari a circa 60% (mentre altre carni superano il 70%) con maggior resa nella cottura e quindi con convenienza economica. 5. È l’animale da allevamento che è meno in competizione con l’uomo per l’alimentazione. Infatti, richiede, per la sua alimentazione, una percentuale molto inferiore di cereali, di leguminose e di altri prodotti utili anche all’uomo. 6. Un allevamento di questi animali ha un minore impatto ambientale.",https://agrispesa.loc/wp-content/uploads/2023/02/default-300x300.png,https://agrispesa.loc/negozio/carne-pesce/coniglio-con-osso/cosce-di-coniglio-g-650-posteriori/,"Coniglio con osso","Agrispesa",19.19EUR,in stock,CARBCCOSCE_2403_54577,,,,0,new,published,,,,,,,
CARBCBISOSSO_2403_54575,"Bistecchine di coniglio g 350 con osso","Le bistecchine di coniglio possono essere cucinate ai ferri o impanate o infarinate. Per la delicatezza del loro sapore le bistecchine di coniglio possono essere accostate a qualsiasi verdura cruda o cotta. La lavorazione delle bistecchine di coniglio avviene direttamente nella nostra azienda. Lavorare le carni nella stessa azienda nella quale sono allevati, oltrechè evitare agli animali gli stress dovuti al trasporto, garantisce che la qualità del prodotto non subisce calo di livello in nessuna fase. Il nostro allevamento è impostato con sistema non intensivo, in ambienti che rispettano il benessere degli animali. Le fattrici partorisco 4 volte l'anno e gli animali raggiungono l'età di macellazione a 5 mesi (negli allevamenti intensivi si arrivano a ottenere più di 10 parti all'anno per fattrice e l'età di macellazione si abbassa a circa 75 giorni). I nostri animali sono nutriti con razioni a base di cereali e foraggi prodotti dall’azienda stessa. In questo modo viene ridotto l’inquinamento dovuto allo spostamento delle materie prime e sono valorizzate le produzioni locali quali foraggi, segala e avena provenienti da terreni altrimenti destinati all’abbandono. Per la prevenzione delle malattie e il soddisfacimento dei fabbisogni di vitamine e minerali ci avvaliamo di oli essenziali e propoli e non utilizziamo mai antibiotici. Perché preferire la carne di coniglio? 1. È molto più digeribile di altre carni. Alcuni tempi di digeribilità: coniglio 2 h, pollo 2,5 h, vitello 3 h, maiale e uova sode 5 h 2. Il potere nutritivo delle bistecchine di coniglio è notevole: 21,5 gr. di proteine su 100 gr. di prodotto. 3. Il suo contenuto in acidi grassi e colesterolo è molto basso: 30/35 mg. per 100 di prodotto contro 70 mg per la carne di vitello e 125 mg per la carne di maiale. 4. Ha un contenuto d’acqua pari a circa 60% (mentre altre carni superano il 70%) con maggior resa nella cottura e quindi con convenienza economica. 5. È l’animale da allevamento che è meno in competizione con l’uomo per l’alimentazione. Infatti richiede, per crescere, una percentuale molto inferiore di cereali, di leguminose e di altri prodotti utili anche all’uomo 6. Un allevamento come il nostro ha un minore impatto ambientale.",https://agrispesa.loc/wp-content/uploads/2023/02/default-300x300.png,https://agrispesa.loc/negozio/carne-pesce/coniglio-con-osso/bistecchine-di-coniglio-g-350-con-osso/,"Coniglio con osso","Agrispesa",12.03EUR,in stock,CARBCBISOSSO_2403_54575,,,,0,new,published,,,,,,,
BAGNETTO1_2403_54574,"Bagnetto verde g 100","E’ il classico 'bagnet' piemontese, la salsa verde a base di prezzemolo, aglio e acciughe sotto sale che viene solitamente servita con il bollito, sui tomini, sulle acciughe.

Modalità di conservazione: conservare in frigorifero a max. +4° C per 10 giorni dall'apertura, aggiungendo un filo d'olio in superficie.

Salsa verde, confezione da 100 g
Ingredienti: PREZZEMOLO, ACCIUGHE, AGLIO, olio evo, PANE senza grassi, aceto, peperoncino.
Allergeni: prezzemolo, acciughe, aglio, grano. Contiene glutine.",https://agrispesa.loc/wp-content/uploads/2023/02/default-300x300.png,https://agrispesa.loc/negozio/salse-olio/salse/bagnetto-verde-g-100/,"Condimenti e salse, Salse e condimenti","Agrispesa",3.96EUR,in stock,BAGNETTO1_2403_54574,,,,0,new,published,,,,,,,
BAGNACAUDA3_2403_54573,"Bagna cauda g 100","La bagna cauda, ad Alba e nelle Langhe, non è solo un piatto della tradizione, è qualcosa di più. La bagna cauda si mangia insieme ad altre persone, parenti o amici. Fare la bagna cauda, nelle colline di Langa, Roero e Monferrato, significa approntare un incontro, una festa conviviale. Va detto che normalmente il lavoro di preparazione è sostenuto interamente dalle donne. Agli uomini, al massimo, si chiede di collaborare sbucciando l’aglio. Le donne, invece, cominciano la mattina a pulire peperoni, cardi, topinambour, cavoli. Mettono a cuocere le cipolle nel forno e, soprattutto, disliscano le acciughe. Per la bagna cauda servono acciughe mature, ma non troppo e non è necessario cercarle di pezzatura grande. Ci sono massaie che sciacquano velocemente le acciughe in un po’ di aceto per togliere loro il sale. Altre preferiscono l’acqua corrente. Qualcosa che oggi non fa più nessuno, e che un tempo, per povertà, era invece la norma, è utilizzare le acciughe senza disliscarle. Anzi, dicevano i vecchi, cercando di convincere prima di tutto se stessi, che il sapore buono veniva proprio dalle lische. Pian piano la casa prende profumo di aglio e di acciughe. Quando arriva la sera e gli amici siedono intorno al tavolo, si scherza sull’odore di aglio che impregnerà i vestiti dei commensali nel giro di poche ore. E ognuno racconta il proprio aneddoto di quando al lavoro, il giorno dopo una storica bagna cauda, tutti i colleghi capivano dall’alito che il compagno aveva partecipato ad un festoso banchetto di bagna cauda. La preparazione del tavolo prevede oggi che ogni commensale abbia un apposito scalda bagna cauda con il lumino acceso a tenere calda la salsa. Un tempo, in modo più rustico e corposo, ma senz’altro più intenso, si praticava il gesto continuo di intingere ciascuno il proprio pezzo di verdura, con le mani o con la forchetta, dentro a un unico paiolo fumante, che ogni tanto la cuoca provvedeva a scaldare e a riempire. Per chi non l’abbia mai provato, è un rito che, come pochi, è legato al sorriso, allo scherzo, alla battuta. Sarà la forza delle acciughe, sarà l’odore dell’aglio? È una magia autunnale da non perdere.",https://agrispesa.loc/wp-content/uploads/2023/02/default-300x300.png,https://agrispesa.loc/negozio/salse-olio/salse/bagna-cauda-g-100/,"Condimenti e salse, Salse e condimenti","Agrispesa",3.85EUR,in stock,BAGNACAUDA3_2403_54573,,,,0,new,published,,,,,,,
BACCALA3_2403_54572,"Baccalà  al verde g 200","Baccalà messo in ammollo, infarinato e cotto leggermente in olio extravergine di oliva. Si può scaldare a vapore o passarlo un attimo in padella senza alcuna aggiunta di olio. Dal sapore delicato, è accostabile a qualsiasi verdura cotta o cruda. Ottimo, ad esempio, con le cipolle stufate e con la polenta.

Modalità di conservazione: 5 giorni di conservazione dalla data di confezionamento.

Ingredienti: baccalà dissalato, farina 00, olio evo, sale.",https://agrispesa.loc/wp-content/uploads/2023/02/default-300x300.png,https://agrispesa.loc/negozio/piatti-preparati/antipasti/baccala-al-verde-g-200/,"Antipasti e secondi di carne e pesce","Agrispesa",10.56EUR,in stock,BACCALA3_2403_54572,,,,0,new,published,,,,,,,
SAS64_2351_54275,"Salsa fuoco e fiamme g 130","Salsa preparata con peperoncini tondi è semplice e genuina, 100% vegana e senza glutine.

Ideale come aggiunta ad un sugo per la pasta o in abbinamento a carni e pesce.",https://agrispesa.loc/wp-content/uploads/2023/02/default-300x300.png,https://agrispesa.loc/negozio/salse-olio/salse/salsa-fuoco-e-fiamme-g-130/,"Condimenti e salse, Salse e condimenti","Agrispesa",5.72EUR,in stock,SAS64_2351_54275,,,,0,new,published,,,,,,,
VERDAROMAPRE5_2351_53544,"Prezzemolo a mazzo","Il prezzemolo è per noi solo una piccola produzione. Lo coltiviamo perchè molte famiglie piemontesi lo usano per preparare il 'bagnèt verd' o per preparare i condimenti del pesce. Nella nostra cucina famigliare impieghiamo il prezzemolo soprattutto per condire le acciughe, appunto con un battuto di aglio e prezzemolo. Il nostro prezzemolo appartiene alla varietà comune, il cultivar più diffuso nel nostro territorio, caratterizzato da foglie piccole con un sapore delicato e non pungente.",https://agrispesa.loc/wp-content/uploads/2023/02/default-300x300.png,https://agrispesa.loc/negozio/verdura/aromatiche-fresche/prezzemolo-a-mazzo/,"Salvia, prezzemolo, origano, alloro e rosmarino","Agrispesa",3.82EUR,in stock,VERDAROMAPRE5_2351_53544,,,,0,new,published,,,,,,,
FRUTBANANE6_5123_53542,"Banane fairtrade g 500","La banana è uno dei primi prodotti, tra quelli coloniali, che dettero vita al commercio equo e solidale ed è uno dei cinque frutti più consumati al mondo, Italia compresa.

Scegliere un prodotto che proviene dalla filiera dell’equo e sostenibile significa invertire questa tendenza, fornire gli strumenti per la crescita e lo sviluppo delle comunità locali consentendo al contempo la preservazione della biodiversità ed il rispetto per l’ambiente.

Secondo Fairtrade International 'la piantagione tipica di banane in America centrale utilizza fino a 70 kg di pesticidi per ettaro per anno - oltre 10 volte di più rispetto alla quantità utilizzata per la produzione di altre colture nei paesi industrializzati. Questi spray chimici possono avere un grave impatto sulla salute dei lavoratori e delle persone che vivono nella zona, e sulla fauna circostante. E in molte piantagioni, le giornate di lavoro possono essere molto lunghe, spesso da 12 a 14 ore con straordinari non pagati e mancanza di sicurezza del lavoro.",https://agrispesa.loc/wp-content/uploads/2023/02/default-300x300.png,https://agrispesa.loc/negozio/frutta/avocado-e-banane/banane-fairtrade-g-500/,"Banane, avocado e melagrana","Agrispesa",4.29EUR,in stock,FRUTBANANE6_5123_53542,,,,0,new,published,,,,,,,
VERDLEGSECLENT2_2347_51904,"Lenticchie g 500","Le lenticchie non sono di mia produzione, ho una collaborazione con un produttore biologico vicino a Perugia, io gli mando giù i borlotti e lui mi manda su ceci e lenticchie. Io non ho mai provato a seminarle, mi dicono che qua non avrei mai il prodotto di qualità come ce l’hanno giù, sono proprio terreni diversi. Sono lenticchie rosse biologiche, sono un po’ più piccole, però sono molto buone. Queste sono belle, hanno la pellicola molto sottile; quelle verdi non le coltivano perché hanno la pellicola spessa e alla gente non piace che poi rimane in bocca quella sensazione un po’ di buccia.",https://agrispesa.loc/wp-content/uploads/2023/02/default-300x300.png,https://agrispesa.loc/negozio/verdura/legumi-secchi-e-preparati/lenticchie-g-500__trashed/,"Legumi secchi","Agrispesa",6.37EUR,in stock,VERDLEGSECLENT2_2347_51904,,,,0,new,published,,,,,,,
TRASPORTO10_51896,"Spedizione","Spedizione",https://agrispesa.loc/wp-content/uploads/2023/02/default-300x300.png,https://agrispesa.loc/senza-categoria/spedizione/,"Senza Categoria","Agrispesa",10EUR,in stock,TRASPORTO10_51896,,,,0,new,published,,,,,,,
TRASPORTO13_51897,"Spedizione","Spedizione",https://agrispesa.loc/wp-content/uploads/2023/02/default-300x300.png,https://agrispesa.loc/senza-categoria/spedizione-2/,"Senza Categoria","Agrispesa",13.5EUR,in stock,TRASPORTO13_51897,,,,0,new,published,,,,,,,
