id,title,description,image_link,link,product_type,brand,price,availability,item_group_id,checkout_url,additional_image_link,sale_price_effective_date,sale_price,condition,visibility,gender,color,size,pattern,google_product_category,default_product,variant
VINROSSO48_2345_51436,"Barbera d'Alba doc cl 75 superiore","Innanzi tutto il nome – Kairòs in greco significa ‘Attimo Supremo’ è quel tempo in mezzo, quel momento di vuoto e di sospensione che si percepisce prime degli avvenimenti importanti, è l’attimo dove tutto può accadere, nel quale fluiscono contemporaneamente tutte le condizioni che lo creano.
Di colore rosso rubino con riflessi violacei ha un profumo intenso e caratteristico. Ricco di note fruttate che ricordano la mora, la prugna e l’amarena e caratterizzato da alcuni sentori speziati che richiamano la cannella e il pepe verde. Il sapore è ampio e corposo con alcuni toni acidi, tipici del vitigno. Persistente e piacevolmente secco è caratterizzato da tannini dolci e morbidi. La freschezza acida conferisce lunghezza al retrogusto.Questo vino esprime il suo massimo con la decantazione, che consiglio vivamente, ma è amabile anche senza. Va servito tra i 18° e 20° C. Per chi sceglie la via della degustazione in più giorni, è opportuno tappare sempre la bottiglia tra un giorno e l’altro.
Questa collezione è di 341 bottiglie numerate",https://agrispesa.loc/wp-content/uploads/2023/02/default-300x300.png,https://agrispesa.loc/negozio/dolci-bevande/birra-vino-liquori/barbera-dalba-doc-cl-75-superiore/,"Vino","Agrispesa",23.23EUR,in stock,VINROSSO48_2345_51436,,,,0,new,published,,,,,,,
VINROSSO47_2345_51435,"Dolcetto d'Alba doc cl 75","Alla degustazione si presenta rosso rubino. Il profumo è immediato e schietto. Ricorda la viola, la ciliegia con richiami di sottobosco e di confettura. Leggeri accenni di ciclamino e fieno donano freschezza al naso. Il sapore pieno e secco è caratterizzato da tannini morbidi ma pronunciati. La struttura è semplice, con intensi aromi fruttati in equilibrio con la nota alcolica. L’acidità moderata è accompagnata da un gradevole retrogusto amarognolo e spiccati sentori di mandorla. Questo vino esprime il suo massimo con la decantazione, che consiglio vivamente, ma è amabile anche senza. Va servito tra i 18° e 20° C. Per chi sceglie la via della degustazione in più giorni, è opportuno tappare sempre la bottiglia tra un giorno e l’altro.
Questa collezione è di 866 bottiglie",https://agrispesa.loc/wp-content/uploads/2023/02/default-300x300.png,https://agrispesa.loc/negozio/dolci-bevande/birra-vino-liquori/dolcetto-dalba-doc-cl-75/,"Vino","Agrispesa",17.21EUR,in stock,VINROSSO47_2345_51435,,,,0,new,published,,,,,,,
SCI17_2347_51433,"Sciroppo menta Piperita ml 250","La qualità di questo sciroppo è data dall'olio essenziale di menta che ne è alla base, il migliore per la finezza del profumo, la gradevolezza del gusto e la delicatezza del suo aroma. All'olio essenziale, che senza aggiunta di altri aromi conferisce allo sciroppo la sua particolare aromaticità e freschezza, viene mescolato lo zucchero bianco. Nessun altro dolcificante viene utilizzato; né conservanti, né coloranti.
E' un prodotto che si presta a molti usi in cucina. Con un cucchiaio di sciroppo in un bicchiere d'acqua si ottiene una bibita deliziosa, molto rinfrescante e balsamica; con uguali dosi si possono preparare granite e ghiaccioli. Questo sciroppo è ottimo anche per insaporire macedonie di frutta, latte o tè.",https://agrispesa.loc/wp-content/uploads/2023/02/default-300x300.png,https://agrispesa.loc/negozio/dolci-bevande/bibite-estratti-e-succhi/sciroppo-menta-piperita-ml-250/,"Succhi, bibite e sciroppi","Agrispesa",12.18EUR,in stock,SCI17_2347_51433,,,,0,new,published,,,,,,,
ERBEAROMATIC39_2347_51432,"Tisana della felicità  g 12 10 bustine con filtro","La liquirizia è una pianta un po’ lunga a crescere, si raccoglie dopo tre anni da quando la pianti. Ha le foglie un po’ come l’acacia e ha una spiga di foglie. Della liquirizia si raccoglie la radice, che poi sono i tronchetti, cioè pezzi di radice. È una pianta molto rustica, ha dei rizomi che corrono sotterranei, è problematica perché non sta dove vorresti farla stare tu, ma viaggia nel campo. Noi l'abbiamo bagnata quando germoglia in primavera, per darle un po’ di aiuto a crescere, ma poi se l'è cavata bene. Quest'anno, avendola raccolta lo scorso autunno, non abbiamo più le piante grandi e dobbiamo ripartire con il ciclo di tre anni per averla di nuovo. Quindi questa primavera metterò dei nuovi piantini che comprerò. La liquirizia è uno degli ingredienti della tisana della felicità: è una pianta tonica che dà brio, infatti è chi ha la pressione alta non la può tanto utilizzare. Noi l'abbiamo chiamata tisana della felicità perché ha liquirizia e basilico che sono due piante che danno tono. Poi ci sono anche melissa, cannella e chiodi di garofano. La tisana della felicità è una tisana speziata, ovviamente la cannella e i chiodi di garofano sono spezie che acquisto perché crescono in altri climi. È una bevanda un po’ invernale, da bere principalmente calda, con gli amici, è un po’ conviviale, non è tanto la tisana che ti bevi da solo per rilassarti, ma una tisana che è bella da bere in compagnia, magari in montagna. Quella in vendita da metà settembre è la prima miscela fatta con la nostra liquirizia. Da adesso in poi, per tutto l’inverno, sarà disponibile.",https://agrispesa.loc/wp-content/uploads/2023/02/default-300x300.png,https://agrispesa.loc/negozio/dolci-bevande/infusi-e-te/tisana-della-felicita-g-12-10-bustine-con-filtro/,"Tisane e infusi","Agrispesa",7.44EUR,in stock,ERBEAROMATIC39_2347_51432,,,,0,new,published,,,,,,,
ERBEAROMATIC34_2347_51431,"Tisana dell'inverno g 12 10 bustine con filtro","La tisana dell’inverno è composta dal 60% echinacea, poi menta piperita e timo. L’echinacea non è una pianta autoctona delle nostre zone, viene dal Nord America; fa dei bellissimi fiori rosa, in estate sono uno spettacolo anche solo per la vista. Della famiglia delle Composite, ha proprietà immunostimolanti, cioè aiuta a rafforzare il sistema immunitario, che così ha più capacità di affrontare i mali di stagione, gli attacchi di virus e batteri. Noi usiamo le sommità fiorite, tagliamo a mano i fiori nel pieno della fioritura, quando sono al pieno, molto bottinate dalle farfalle; raccogliamo i fiori, li facciamo essiccare e poi li trituriamo. Utilizziamo tutte le sommità fiorite, dell’echinacea si utilizza anche la radice, che però noi non usiamo più che altro perché non abbiamo ancora inserito nei nostri processi di lavorazione la lavorazione delle radici, che è un po’ più complicata per l’essiccazione; è un passaggio che faremo il prossimo anno. Tra l’altro, tagliando solo la sommità fiorita, la pianta continua la sua vita, mentre se si prendono le radici l’anno successivo bisogna ripiantare tutto. Però è una cosa interessante, perché le radici contengono molto più principio attivo e infatti sono molto utilizzate dalle erboristerie come base per produrre tinture, estratti idroalcolici con cui si fanno tutti i preparati per la cura e la prevenzione per la stagione invernale.

Insieme all’echinacea, la tisana dell’inverno ha la menta piperita e il timo. Il timo è un potente antibatterico e quindi aiuta nelle sue funzioni questa tisana. La menta, di per sé, ha più che altro una funzione di gusto, perché rende la tisana più piacevole. Si chiama Tisana dell’inverno per ricordare la sua proprietà di aiutarci ad affrontare la stagione invernale con tutte le sue insidie.",https://agrispesa.loc/wp-content/uploads/2023/02/default-300x300.png,https://agrispesa.loc/negozio/dolci-bevande/infusi-e-te/tisana-dellinverno-g-12-10-bustine-con-filtro/,"Tisane e infusi","Agrispesa",7.44EUR,in stock,ERBEAROMATIC34_2347_51431,,,,0,new,published,,,,,,,
ERBEAROMATIC33_2347_51430,"Tisana dopo pasto g 12 10 bustine con filtro","La salvia e il rosmarino, insieme al limone, hanno ottime proprietà digestive. Il nostro campo di salvia officinalis si trova davanti alla borgata. Raccogliamo la salvia 2 o 3 volte all'anno; al primo taglio, a primavera inoltrata, ha dei bellissimi fiori blu/viola. Il rosmarino cresce prosperoso e alla nostra altitudine ed esposizione, sviluppa un aroma tipico dei climi mediterranei.

Le bustine filtro sono in carta non sbiancata, con filo di cotone, 100% plastic free, prodotte senza l'utilizzo di colle. Le riempiamo a mano, una ad una, nel nostro laboratorio in montagna.

Ingredienti: salvia, rosmarino, scorze di limone.",https://agrispesa.loc/wp-content/uploads/2023/02/default-300x300.png,https://agrispesa.loc/negozio/dolci-bevande/infusi-e-te/tisana-dopo-pasto-g-12-10-bustine-con-filtro/,"Tisane e infusi","Agrispesa",7.44EUR,in stock,ERBEAROMATIC33_2347_51430,,,,0,new,published,,,,,,,
CERPASGANTCORT1_2345_51429,"Gnocchetti semintegrali g 300 di grani antichi","I grani antichi sono vecchie varietà di grano, un tempo coltivate per le loro caratteristiche organolettiche e nutrizionali ma poi man mano abbandonate dall’industria alimentare per far spazio ad altre varierà, più resistenti ed adatte alle lavorazioni meccaniche ed all’uso di pesticidi. I grani antichi, pur avendo una produttività inferiore rispetto alle varietà moderne, risultano molto digeribili e sprigionano profumi intensi e piacevoli. E’ con questa farina che vengono prodotti i Gnocchetti di grani antichi. 

Modalità di conservazione: conservare in luogo fresco e asciutto, al riparo dalla luce. 
Tempo di cottura: 5/6 minuti. 
Ingredienti: farina di GRANO tenero tipo “0”, farina di GRANO tenero tipo “2”, acqua.
Allergeni: cereali contenenti glutine.",https://agrispesa.loc/wp-content/uploads/2023/02/default-300x300.png,https://agrispesa.loc/negozio/pane-cereali/pasta-e-pastina/gnocchetti-semintegrali-g-300-di-grani-antichi/,"Pasta di grano duro","Agrispesa",4.98EUR,in stock,CERPASGANTCORT1_2345_51429,,,,0,new,published,,,,,,,
CERPASCURSAL1_2345_51428,"Tajarin alla salvia g 250 di grani antichi","I grani antichi sono vecchie varietà di grano, un tempo coltivate per le loro caratteristiche organolettiche e nutrizionali ma poi man mano abbandonate dall’industria alimentare per far spazio ad altre varierà, più resistenti ed adatte alle lavorazioni meccaniche ed all’uso di pesticidi. I grani antichi, pur avendo una produttività inferiore rispetto alle varietà moderne, risultano molto digeribili e sprigionano profumi intensi e piacevoli. E’ con questa farina che vengono prodotti i Tajarin, cibo della festa per eccellenza della tradizione piemontese, in questa versione arricchiti con salvia. 

Modalità di conservazione: conservare in luogo fresco e asciutto, al riparo dalla luce. 
Tempo di cottura: 5/6 minuti. 
Pasta annidata a mano. 

Ingredienti: miscela di GRANI antichi tipo “0”, salvia (1.5%), acqua.
Allergeni: cereali contenenti glutine.",https://agrispesa.loc/wp-content/uploads/2023/02/default-300x300.png,https://agrispesa.loc/negozio/pane-cereali/pasta-e-pastina/tajarin-alla-salvia-g-250-di-grani-antichi/,"Pasta di grano duro","Agrispesa",4.98EUR,in stock,CERPASCURSAL1_2345_51428,,,,0,new,published,,,,,,,
CERPASCURCUMAL5_2343_51427,"Tajarin alla curcuma g 250 di grani antichi","I grani antichi sono vecchie varietà di grano, un tempo coltivate per le loro caratteristiche organolettiche e nutrizionali ma poi man mano abbandonate dall’industria alimentare per far spazio ad altre varierà, più resistenti ed adatte alle lavorazioni meccaniche ed all’uso di pesticidi. I grani antichi, pur avendo una produttività inferiore rispetto alle varietà moderne, risultano molto digeribili e sprigionano profumi intensi e piacevoli. E’ con questa farina che vengono prodotti i Tajarin, cibo della festa per eccellenza della tradizione piemontese, in questa versione arricchiti con curcuma. 

Modalità di conservazione: conservare in luogo fresco e asciutto, al riparo dalla luce. 
Tempo di cottura: 5/6 minuti. 
Pasta annidata a mano. 

Ingredienti: miscela di GRANI antichi tipo “0”, curcuma (1.5%), acqua.
Allergeni: cereali contenenti glutine.",https://agrispesa.loc/wp-content/uploads/2023/02/default-300x300.png,https://agrispesa.loc/negozio/pane-cereali/pasta-e-pastina/tajarin-alla-curcuma-g-250-di-grani-antichi/,"Pasta di grano duro","Agrispesa",4.98EUR,in stock,CERPASCURCUMAL5_2343_51427,,,,0,new,published,,,,,,,
CERPASCURBAS1_2345_51426,"Tagliatelle al basilico g 250 di grani antichi","I grani antichi sono vecchie varietà di grano, un tempo coltivate per le loro caratteristiche organolettiche e nutrizionali ma poi man mano abbandonate dall’industria alimentare per far spazio ad altre varierà, più resistenti ed adatte alle lavorazioni meccaniche ed all’uso di pesticidi. I grani antichi, pur avendo una produttività inferiore rispetto alle varietà moderne, risultano molto digeribili e sprigionano profumi intensi e piacevoli. E’ con questa farina che vengono prodotte le Tagliatelle al basilico. 

Modalità di conservazione: conservare in luogo fresco e asciutto, al riparo dalla luce. 
Tempo di cottura: 5/6 minuti. 
Pasta annidata a mano. 

Ingredienti: miscela di GRANI antichi tipo “0”, basilico (1.5%), acqua.
Allergeni: cereali contenenti glutine.",https://agrispesa.loc/wp-content/uploads/2023/02/default-300x300.png,https://agrispesa.loc/negozio/pane-cereali/pasta-e-pastina/tagliatelle-al-basilico-g-250-di-grani-antichi/,"Pasta di grano duro","Agrispesa",4.98EUR,in stock,CERPASCURBAS1_2345_51426,,,,0,new,published,,,,,,,
VERDSPINACI2_2143_51137,"Spinaci g 500","Lavoriamo la terra con metodi tradizionali ed utilizziamo come concime del letame bovino prodotto da allevamenti della zona. Le costine e gli spinaci sono per noi due importanti coltivazioni che ci permettono di utilizzare i campi nel periodo invernale. I nostri spinaci appartengono ad una varietà caratterizzata dall’elevata resistenza alle basse temperature. Ogni anno acquistiamo i semi che seminiamo in tardo autunno sia sotto serra che in campo aperto. Gli spinaci in campo aperto vengono raccolti solitamente agli inizi di marzo. Gli spinaci che raccolgo a novembre li ho seminati all’inizio di settembre. Sia spinaci che costine entro la metà di settembre deve essere tutto seminato. Soprattutto per seminare seguiamo le fasi lunari, deve venire la luna piena e lascia passare 3 giorni dopo che è venuta la luna piena oppure, come dicevano anche gli anziani, se la luna piena viene al giovedì devi aspettare che passi il mercoledì successivo, sono più di 3 giorni. Altrimenti lo spinacio, come la costina, o la cipolla va subito a seme. Oggi in agricoltura si fa ancora così.",https://agrispesa.loc/wp-content/uploads/2023/02/default-300x300.png,https://agrispesa.loc/negozio/verdura/foglie-da-cottura/spinaci-g-500/,"Foglie da cottura","Agrispesa",3.19EUR,in stock,VERDSPINACI2_2143_51137,,,,0,new,published,,,,,,,
VERDRAMOLACCIO1_2345_51136,"Ramolaccio g 250","Ramolaccio g 250",https://agrispesa.loc/wp-content/uploads/2023/02/default-300x300.png,https://agrispesa.loc/negozio/verdura/barbabietola-radici-e-rape/ramolaccio-g-250/,"Radici e rape","Agrispesa",1.91EUR,in stock,VERDRAMOLACCIO1_2345_51136,,,,0,new,published,,,,,,,
VERDPEPERONI43_2345_51135,"Peperone quadrato g 500","Il nostro peperone quadrato appartiene a una varietà che ben si adatta alle caratteristiche dei nostri terreni. Assomiglia al più celebre peperone quadrato d'Asti, ma a differenzia di questi, è meno precoce: mentre quello di Asti matura a fine luglio - inizio agosto, il nostro peperone quadrato è pronto per la raccolta a fine estate. Come dice il nome, si tratta di un peperone dalla forma quadrata. Si caratterizza per la buccia sottile, la polpa spessa e il sapore dolce. Acquistiamo i semi in primavera, li facciamo germinare negli erbai e mettiamo le pianticelle a dimora sotto serra nel mese di giugno. Il peperone quadrato è un ortaggio che necessita di molte cure; per fare un confronto con il più rustico pomodoro, possiamo dire che una serra di peperone quadrato necessita di 10 volte più lavoro di una serra equivalente di pomodori. La pianta è molto fragile e porta dei frutti estremamente pesanti che rischiano di spezzare i rami. Per questo motivo è necessario effettuare la legatura a bastoni di supporto non solo del fusto centrale della pianta, ma anche di ogni singolo ramo. Questa solanacea, inoltre, è soggetta all'azione di numerosi patogeni, sia virus che parassiti, che possono portare alla perdita di intere serre. Nella coltivazione biologica, purtroppo, ci sono pochissimi rimedi. Il peperone quadrato ama il caldo, ma quando la temperatura esterna raggiunge i 40° C, per quanto cerchiamo di ombreggiare le serre, è difficilissimo proteggerlo dalle scottature.",https://agrispesa.loc/wp-content/uploads/2023/02/default-300x300.png,https://agrispesa.loc/negozio/verdura/pomodori/peperone-quadrato-g-500/,"Pomodori e peperoni","Agrispesa",5.1EUR,in stock,VERDPEPERONI43_2345_51135,,,,0,new,published,,,,,,,
VERDPAKCHOI5_2345_51134,"Pak choi g 300","Il pak choi ha le foglie larghe, croccanti, che ricordano un po' sia le bietole che le coste. Si può gustare crudo in insalata, oppure cotto al vapore, saltato in padella o grigliato. In generale consiglio di cuocerlo brevemente.",https://agrispesa.loc/wp-content/uploads/2023/02/default-300x300.png,https://agrispesa.loc/negozio/verdura/foglie-da-cottura/pak-choi-g-300/,"Foglie da cottura","Agrispesa",1.83EUR,in stock,VERDPAKCHOI5_2345_51134,,,,0,new,published,,,,,,,
VERDMINPRONTO3_2345_51133,"Verdure per minestrone g 500 tagliate a cubetti","Verdure biologiche per minestrone tagliate a pezzi in sacchetti sottovuoto.  

Si conserva in frigo una settimana e se non viene consumato si può conservare in congelatore.",https://agrispesa.loc/wp-content/uploads/2023/02/default-300x300.png,https://agrispesa.loc/negozio/verdura/minestre-fresche-verdura/verdure-per-minestrone-g-500-tagliate-a-cubetti/,"Minestre fresche","Agrispesa",10.19EUR,in stock,VERDMINPRONTO3_2345_51133,,,,0,new,published,,,,,,,
VERDINSALATA179_2345_51132,"Radicchio di Treviso g 400","Ho piantato il radicchio di Treviso la seconda settimana di agosto su pacciamatura: ha subito un passaggio di decespugliatore nei solchi tra la pacciamatura, un trattamento di compost tea e poi basta. Il compost tea è sostanzialmente una coltura di microrganismi: si effettua mettendo del compost in acqua, aggiungendo eventualmente zucchero, e facendo gorgogliare dell'aria con una pompetta: questo fa sì che l'acqua sia molto ossigenata e quindi si sviluppa una micro flora aerobica - che usa l’ossigeno per vivere - molto varia e numerosa. Questi microrganismi, sparsi sulle colture, in questo caso sulla coltivazione del radicchio di Treviso, entrano in simbiosi con le cellule vegetali, avendo normalmente un effetto rafforzativo su di esse, quindi riescono a far sì che la pianta assorba meglio gli elementi nutritivi; inoltre vanno a occupare degli posti che potrebbero essere occupati dai patogeni e quindi le “immunizzano” in parte da alcune malattie. Il compost di partenza è una cosa che faccio io, si tratta semplicemente di sostanza organica molto decomposta; acquisto il letame, anche se ormai sono anni che non lo acquisto più, ho un accumulo di compost in azienda e uso sempre quello, perché il compost, una volta che le fermentazioni sono finite, è stabile, non cambia più la sua composizione nel tempo. Questo compost tea si mette sulla foglia come se fosse un trattamento anti parassitario con una pompa a spalla. Sul radicchio di Treviso l’ho messo circa 20 giorni dopo che è stato piantato. Ho fatto quel trattamento in modo che il radicchio di Treviso diventasse più robusto. Il biologico, per certi versi, è più facile: noi facciamo biologico che ci consenta di lavorare “meno”, nel senso che lasciamo che le piante si arrangino, però dobbiamo far sì che l'ambiente dove crescono sia consono alla loro crescita, quindi il terreno deve essere fertile ecc., dopodiché non è detto che la produttività del bio sia uguale a quella convenzionale dal momento che la produttività si misura in kg. Le verdure rafforzano il sistema immunitario per una questione chimica, grazie ai microelementi che contengono: elementi minerali o enzimi presenti in piccola quantità che però migliorano il funzionamento cellulare; sono presenti nelle verdure e non in altri elementi. Il rosso del radicchio di Treviso è dovuto agli antociani, che sono degli antiossidanti.",https://agrispesa.loc/wp-content/uploads/2023/02/default-300x300.png,https://agrispesa.loc/negozio/verdura/insalate/radicchio-di-treviso-g-400/,"Insalate","Agrispesa",2.85EUR,in stock,VERDINSALATA179_2345_51132,,,,0,new,published,,,,,,,
VERDDATTERINI24_2345_51131,"Pomodoro Datterino g 250","Quest’anno ho messo circa 1200 piante di datterini. Gli anni scorsi mettevamo una varietà che però sempre ci dava dei problemi, così abbiamo cambiato. Quest’anno, per essere sicuri, abbiamo trovato un’altra varietà che costa tantissimo, 370€ per 1000 semi. Il trapianto è stato fatto a inizio aprile. Oggi le piante sono molto belle. Ho sempre messo le piante di datterini a 30 cm sulla fila, ma quest’anno queste piante sono così sviluppate, che l’anno prossimo dovrò aumentare la distanza. Infatti le piante molto fitte possono inibire la circolazione dell’aria. I primi datterini che abbiamo raccolto sono già buoni, ma si addolciranno sempre più a mano mano che si proseguirà con il raccolto. Ho notato che in questa varietà il datterino attaccato alla pianta tende ad essere piuttosto fragile, quindi dobbiamo essere molto attenti nel passare tra le file, perché si staccano con facilità anche se sono ancora verdi.",https://agrispesa.loc/wp-content/uploads/2023/02/default-300x300.png,https://agrispesa.loc/negozio/verdura/pomodori/pomodoro-datterino-g-250/,"Pomodori e peperoni","Agrispesa",2.55EUR,in stock,VERDDATTERINI24_2345_51131,,,,0,new,published,,,,,,,
VERDCOSTINE36_2050_51130,"Costine g 500","Lavoriamo la terra con metodi tradizionali ed utilizziamo come concime del letame bovino prodotto da allevamenti della zona. Le costine e gli spinaci sono per noi due importanti coltivazioni che ci permettono di utilizzare i campi nel periodo invernale. I nostri spinaci appartengono ad una varietà caratterizzata dall’elevata resistenza alle basse temperature. Ogni anno acquistiamo i semi che seminiamo in tardo autunno sia sotto serra che in campo aperto. Gli spinaci in campo aperto vengono raccolti solitamente agli inizi di marzo.",https://agrispesa.loc/wp-content/uploads/2023/02/default-300x300.png,https://agrispesa.loc/negozio/verdura/foglie-da-cottura/costine-g-500/,"Foglie da cottura","Agrispesa",2.29EUR,in stock,VERDCOSTINE36_2050_51130,,,,0,new,published,,,,,,,
VERDCAVOLORAPA9_2345_51128,"Cavolo rapa g 500","Per tante persone il cavolo rapa è un ortaggio quasi sconosciuto anche se è molto semplice da cucinare, sia crudo che cotto in forno o in vaporiera senza però superare i 100°. Non va sbucciato e si può mangiare anche la foglia.",https://agrispesa.loc/wp-content/uploads/2023/02/default-300x300.png,https://agrispesa.loc/negozio/verdura/broccoli-cavolfiori-e-cavoli/cavolo-rapa-g-500/,"Broccoli, cavolfiori e cavoli","Agrispesa",3.06EUR,in stock,VERDCAVOLORAPA9_2345_51128,,,,0,new,published,,,,,,,
VERDCAVOLOVERZ3_2345_51129,"Cavolo Verza kg 1","Il cavolo verza è stato piantato intorno a fine luglio, ne abbiamo messo circa 4000 piante. Normalmente si può raccogliere oltre al cavolo centrale anche le foglie che lo circondano. Il problema grosso è che quest'anno nei nostri terreni, che ha fatto dei mesi molto piovosi, le foglie intorno sono leggermente ingiallite, non sono più tanto belle e quindi consumiamo solo il cavo all'interno.

Quando facciamo il capunet - gli involtini di carne con il cavolo intorno – noi usiamo le foglie di questo cavolo qua. Essendo un cavolo che tendenzialmente si prende diverse gelate, tende a essere un cavolo abbastanza dolce. Non si può mangiare crudo perché comunque la foglia è più bollosa e meno liscia rispetto ad altre e quindi tende a essere un po' più coriacea.",https://agrispesa.loc/wp-content/uploads/2023/02/default-300x300.png,https://agrispesa.loc/negozio/verdura/broccoli-cavolfiori-e-cavoli/cavolo-verza-kg-1/,"Broccoli, cavolfiori e cavoli","Agrispesa",3.82EUR,in stock,VERDCAVOLOVERZ3_2345_51129,,,,0,new,published,,,,,,,
