id,title,description,image_link,link,product_type,brand,price,availability,item_group_id,checkout_url,additional_image_link,sale_price_effective_date,sale_price,condition,visibility,gender,color,size,pattern,google_product_category,default_product,variant
ERBEAROMATIC38_2308_24517,"Dado vegetale essiccato g 100","Abbiamo pensato di fare il dado vegetale essiccato perché l’essiccazione, tra tutte le lavorazioni, è quella probabilmente più vicina al ritmo del contadino, che avviene quasi naturalmente. Mentre il vino, il formaggio hanno una trasformazione completa della materia, l’essicazione è una cosa che fa la natura di per sé, il contadino deve solo accompagnare, è come il fieno per intenderci, e il dado vegetale essiccato ci è sembrato un modo molto semplice per conservare i prodotti. Questa è la prima cosa, poi mi sono reso conto che l’essiccazione apre un mondo enorme, quasi come quello dei fermentati. Difatti il dado vegetale essiccato è il primo prodotto, ma vorremmo poi farne altri. 
  
  L'essiccazione, inoltre, sta a pieno titolo nel discorso del riciclo, del riuso, perché tu vai a usare prodotti che non sono di scarto, perché sono materie prime ottime, magari di secondaria importanza perché un po’ più piccoline, però non sono prodotti di scarto, questa è una cosa fondamentale, anzi, a volte, quando siamo in carenza, usiamo anche prodotti di prima scelta. 
  
  Ci siamo affascinati a questa tecnica di conservazione e la prima cosa che ci è venuta in mente è il dado vegetale essiccato: prima cosa, è difficilissimo trovare dei dadi commerciali buoni, cioè buoni dal punto di vista delle materie prime. Poi il brodo è un po’ alla base di tutte le ricette tradizionali italiane, un po’ come le spezie per i Paesi del Nordafrica, per la cultura orientale. Noi abbiamo il brodo oppure gli aromi classici - l'alloro, il rosmarino - quindi era un po’ chiudere un ciclo: avevamo da una parte la materia prima, tutto quel prodotto alimentarmente buono ma un po’ meno bello - gli scarti di verdura vera e propria, tipo le foglie di verdura, le diamo alle pecore. Seconda cosa, vai a trasformare la verdura, a farla passare da piatto principale a quel retrogusto che va a lavorare su tutti i gusti, quindi in cucina ti trasforma un sacco di piatti. 
  
  Puoi usare il dado vegetale essiccato come insaporitore per il brodo ma anche sulle carni; quando arrivi a casa di corsa che hai 10 minuti per far pranzo butti giù una pasta al volo o un riso in bianco, ci metti una spolveratina di dado vegetale essiccato e ti cambia subito tutto il discorso. Quindi il nostro dado vegetale essiccato può essere considerato un insaporitore ad ampio raggio. 
  
  Per essiccare andiamo sempre a bassa temperatura, sui 40°. L'essiccazione è principalmente una perdita di acqua, la temperatura è solo per un discorso di velocità, a noi non interessa più di tanto, ci interessa mantenere le proprietà del prodotto come se fosse crudo, sali minerali, tutto quello che serve dentro, quindi andiamo molto cauti. 
  
  L'altra cosa bella che si va a sposare col dado vegetale essiccato è il sale, strumento di conservazione eccezionale che va a completare l'opera. A un prodotto già secco, quindi stabile, aggiungi il sale e hai un insaporitore, un nutrimento del pensiero -si dice che il sale nutri il pensiero- che esalta il sapore, quindi tutto quello che viene dopo prende gusto, accende i colori, i profumi, la fantasia, quindi anche la parte più sensoriale viene appagata. 
  
  Nel nostro dado vegetale essiccato, come ingredienti, di base c'è sempre carota, cipolla, sedano poi verdure di stagione in base a cosa c'è. Poi mettiamo giusto un filino di curcuma (che nessuno se ne accorge) perché riesce ad amalgamare i gusti, un filino d'olio e sale, chiaramente. L’olio è molto importante perché fa da collante rispetto a tutti gli ingredienti, l'unica cosa è che, dato che c'è l'olio, consiglio di conservare il dado vegetale essiccato in un barattolino in frigorifero.",https://agrispesa.loc/wp-content/uploads/2023/02/default-300x300.png,https://agrispesa.loc/negozio/dado-vegetale-essiccato-2/,"Condimenti per minestre, Dado e soffritto, Negozio","Agrispesa",3.89EUR,in stock,ERBEAROMATIC38_2308_24517,,,,0,new,published,,,,,,,
CERFAR96_2308_24509,"Farina Buratto kg 1 tipo 2","Per quanto riguarda la varietà dei grani, quella che utilizziamo per fare la farina buratto è sempre la stessa, la nostra miscela, le varietà antiche, le cose che abbiamo già scritto. 
  
  Quello che indica la tipologia di 00, 0, 1, 2 ecc. è dato da un’analisi che si chiama analisi delle ceneri, quindi si prende un decimetro cubo di farina, si brucia e le ceneri che rimangono si pesano e da quello si dice che tipologia è. 
  
  Se la 0 deriva da una macinazione con la quale perdiamo un 30-35% del peso complessivo del chicco, con la 00 ne perdiamo anche il 50%. Ne perdi perché il mulino ha il vantaggio a fare dei semi lavorati che utilizza principalmente per i mangimi. Più raffina più ha un prodotto tecnicamente prestante e tutto il nutriente, alla fine, va a finire nei mangimi (farinaccio, farinello, le crusche in genere). 
  
  Al contrario, abbiamo la macinazione grossolana dove tu macini praticamente tutto e tutto rimane dentro; di solito si prende un setaccio a maglia molto larga e si cerca di eliminare la crusca esterna. 
  Quindi macini a pietra, il macinato esce, c’è un setaccio che è un quadrato che gira, però può fare solo una selezione quindi può essere che rimanga fuori della crusca, ma può essere che rimanga fuori qualcos’altro come il germe, la parte bianca, dell’amido. 
  
  Con la farina buratto le cose cambiano, perché al posto del setaccio c’è un cilindro lungo anche 2-3 metri tipo come un grandissimo cestello di una lavatrice messo un po’ inclinato. All’interno ci sono altri cilindri più piccoli messi uno dentro l’anno, quindi il macinato cade nel cilindro più interno poi esce poi cade in quello più esterno poi esce poi cade in quello più esterno ancora; quello che ne deriva è il risultato di quello che hai setacciato, la farina buratto, mentre quello che rimane dentro continua ad andare avanti.
  
  
  Così, se tu fai le analisi delle ceneri, abbiamo un 30-40% in meno nella tipo 0, nella tipo 2 siamo intorno al 10-12% di perdita del chicco. Invece nella farina buratto noi andiamo a prendere un 12 massimo 15%, quindi rimaniamo nella stessa categoria, però al tatto la farina buratto ti sembra impalpabile come una farina bianca. Quindi la farina buratto riesce ad avere tutta la prestanza tecnica della tipo 0 e tutto l'aspetto organolettico della tipo 2 integrale.
  
  Non fanno tutti così perché il buratto è uno di quelli strumenti vecchi che devi andare a cercarti; seconda difficoltà e che dovendo lavorare piano piano piano e dovendo dare al buratto il tempo di lavorare, si impiega molto più tempo per ottenere la farina buratto. Noi non abbiamo la macina in azienda, facciamo sempre in accordo con il mulino, però il mugnaio ogni quarto d'ora, mezz’oretta al massimo si deve fermare, aspettare un quarto d'ora, 20 minuti che raffreddino le macine in modo tale che non riscaldi la farina buratto.",https://agrispesa.loc/wp-content/uploads/2023/02/default-300x300.png,https://agrispesa.loc/negozio/farina-buratto/,"Farine di grano, Negozio","Agrispesa",4.54EUR,in stock,CERFAR96_2308_24509,,,,0,new,published,,,,,,,
CERGRA42_2308_24511,"Fiocchi di avena g 400","L’avena è un cereale incredibile come cereale in sé, perché è l’espressione magica del femminile, è un cereale molto leggero, estremamente dolce, che si muove con leggerezza, ha questa leggera curvatura mentre il grano tende sempre ad andare verso il sole, l’orzo è dritto che sembra un soldato, l’avena invece è questa gentilezza e morbidezza incredibile e quindi, secondo me, nell’organismo agricolo era fondamentale averla anche perché va bene nell’alimentazione umana e foraggera, quindi tutta la pulizia della produzione, i chicchi rotti, la crusca e tutto quanto diventa un’ottima alimentazione animale e non c’è scarto. 
  
  Anche la paglia è una paglia pazzesca, ha un sacco di sostanza organica, quindi alla peggio, se tutto andasse male, posso fare una concimazione con un bel sovescio della forza della sua delicatezza, del suo amore. E' una pianta che cercavo da un bel po’. Il primo grosso problema che ho riscontrato è che per quanto riguarda la filiera animale, in Italia, nel Mezzogiorno, nel Mediterraneo, siamo molto forniti, per quello che è l’alimentazione umana, invece, siamo scarsissimi. Ho scoperto che essendo un prodotto che si mangia più al Nord, tutta l’avena che arriva in Italia è prodotta in Francia e nel Nord Europa in generale, la più vicina arriva dalla Francia, soprattutto l’avena per alimentazione umana che, o viene decorticata o non ha questa crusca così coriacea e si può mettere nelle varie preparazioni. E’ stato un lungo lavoro di ricerca prima di aver trovato la soluzione e siamo ancora alla ricerca di varietà sempre più adatte. 
  
  Da lì abbiamo cercato dei sistemi per esprimere la sintesi dell’organismo agricolo. I fiocchi il primo passaggio e poi il muesli.",https://agrispesa.loc/wp-content/uploads/2023/02/default-300x300.png,https://agrispesa.loc/negozio/fiocchi-di-avena-2/,"Cereali in fiocchi, Negozio","Agrispesa",4.76EUR,in stock,CERGRA42_2308_24511,,,,0,new,published,,,,,,,
CERGRA43_2308_24512,"Muesli g 300","Il muesli è un altro coronamento, un’altra cosa cui stavo dietro da un sacco di tempo, come il dado, che è un po’ la sintesi dell’orto perché ci sono tutte le verdure che fruiscono dentro al dado, l’insaporitore, qui invece è una sintesi dei frutteti: noi abbiamo tantissime varietà in piccolissime produzioni per cui sono sempre molto in difficoltà a fare delle forniture perché arriva uno e mi chiede 5 quintali di frutta che è il minimo minimo minimo – un’azienda che fa frutta penso ne faccia minimo 100 quintali – e io magari non ce l’ho quella frutta lì, perché ho tante varietà di mele, di pesche e via dicendo. Quindi tutti i giorni, da giugno a settembre-ottobre, arriviamo a casa con 3-4 cassette di frutta mista, quelle che si riescono a dare via, bene, le altre abbiamo pensato che seccarle era il modo migliore. 
  
  Il muesli secondo me è una sintesi perché oltre a unire la forza dei frutteti, l’aspetto zuccherino, andiamo a unire anche i campi di cereali. Non voglio prendermi meriti di niente perché non mi interessa, ma penso che non esista muesli agricolo in commercio, anche perché è un lavorone enorme, perché pulisci tutta la frutta, tagliala, falla seccare per tutta l’estate, fai tutte le scorte per un prodotto che andrà mangiato in inverno, poi fai fioccare l’avena e fai confluire tutto: non è così semplice come uno pensa, perché noi siamo abituati che ah, voglio fare quello, vai a comprare gli ingredienti e butti dentro invece se pensi di fare il muesli con i i tuoi prodotti… noi siamo partiti due anni fa per avere il primo pacchetto di muesli quest’anno. Preparare i campi, metterli in rotazione, fare crescere l’avena, prendere gli essiccatori, organizzarsi. In agricoltura devi avere sempre un anticipo. 
  
  Il muesli si preparare come porridge, un po’ più caldo, si può far cuocere con un latte di avena, di orzo, di mandorle oppure anche con il latte di mucca oppure del succo di frutta o anche un po’ d’acqua, velocissimo perché si mette in padella mezza tazzina d’acqua con 4-5 cucchiai di muesli, nel momento in cui l’acqua evapora – circa 2 minuti – è pronto. 
  
  Adesso stiamo già lavorando a una versione da mettere nello yogurt, quindi in un prodotto fresco. In quel caso, siccome la nostra avena è bella tosta, bisogna aspettare un attimino che si inumidisca, sennò col porridge è eccezionale, molto veloce. 
  
  Abbiamo poi aggiunto un po’ di nocciole biologiche. Alla fine hai una bella colazione che se mangi mezzo tazzone di quello arrivi a pranzo che hai un’energia pazzesca e non hai fame. È un alimento che non ingrassa, è pura energia disponibile, non è immondizia che il corpo deve in qualche modo sbattere fuori perché si va a sedimentare nei tessuti adiposi. 
  
  Il muesli è fatto di fiocchi, nocciole e c’è una parte di uva sultanina. Questa per ora l’acquistiamo, mi sono già informato per mettere delle piante però sarà un processo un po’ più lungo perché è difficilissimo trovarle, in Piemonte è anche comprensibile. 
  
  Il muesli che prepariamo sono dei mix di frutta in base a quello che pian piano stocchiamo, quindi il gusto può variare un pochettino. Adesso stiamo lavorando con i cachi, le mele, abbiamo ancora un po’ di pere, stiamo andando avanti a essiccare kiwi e mele. Nel muesli che stiamo commercializzando adesso ci sono ancora delle pesche nostre.",https://agrispesa.loc/wp-content/uploads/2023/02/default-300x300.png,https://agrispesa.loc/negozio/muesli/,"Cereali in fiocchi, Negozio","Agrispesa",5.49EUR,in stock,CERGRA43_2308_24512,,,,0,new,published,,,,,,,
FORVAFRE2_2212_24494,"Mozzarella g 250","Come riconoscere la mozzarella di qualità? Guardando la confezione dobbiamo trovare l’indicazione che è stata ottenuta da latte crudo. Solo le mozzarelle a latte crudo sono realizzate con latte di qualità superiore che, avendo carica microbica ridotta, non necessita pastorizzazione prima della lavorazione. Se questa dicitura manca sappiamo che le mozzarelle sono realizzate con latte di qualità inferiore.Dopo l’apertura della confezione bisogna guardare la mozzarella. Deve presentare un aspetto umido e lucido, in caso contrario o non è stata conservata correttamente o non è mozzarella. Successivamente dobbiamo tagliare la mozzarella: lungo il taglio deve fuoriuscire abbondante latticello. Da questa indicazione possiamo capire se il formaggio è stato ottenuto da cagliata fresca o da cagliata conservata. Alcuni spacciano per prodotti italiani delle mozzarelle ottenute da cagliate fatte in altri Paesi, congelate, trasportate in Italia e solo allora filate. Quindi più una cagliata è stata conservata/trattata, minore sarà il quantitativo di latticello che uscirà dal taglio.Infine dobbiamo percepire il profumo del latte fresco e assaggiandole dobbiamo sentirne il gusto. Le mie mozzarelle sono fatte con il latte crudo munto in giornata e ne conservano intatto il gusto e l’aroma. Dalla preparazione alla consegna al cliente passano meno di 4 giorni, pertanto sono sempre prodotti freschi. Trattandosi di lavorazioni artigianali, il prodotto difficilmente può essere sempre identico a se stesso. Una maggiore o minore compattezza e un sapore più o meno acidulo possono dipendere da fattori legati alla lavorazione giornaliera. Modalità di conservazione: conservare in frigorifero a +4°C.Mozzarella. Formaggio fresco a pasta filata.Ingredienti: LATTE, caglio.Allergeni. Contiene LATTE.Origine del latte: ItaliaNumero di riconoscimento sanitario: IT Z986F CE",https://agrispesa.loc/wp-content/uploads/2023/02/default-300x300.png,https://agrispesa.loc/negozio/mozzarella/,"Vaccini freschi, Negozio","Agrispesa",5.73EUR,in stock,FORVAFRE2_2212_24494,,,,0,new,published,,,,,,,
FORVAFRE23_24495,"Ricottina g 300","Questa ricotta è prodotta da siero residuo della lavorazione delle mozzarelle, con aggiunta di latte.  Modalità di conservazione: conservare a +2/4°C.Ricotta.Ingredienti: siero, sale, acidificante: acido citrico.Allergeni: contiene tracce di LATTE.Origine del latte: ITALIANumero di riconoscimento sanitario: IT Z986F CE",https://agrispesa.loc/wp-content/uploads/2023/02/default-300x300.png,https://agrispesa.loc/negozio/ricottina-2/,"Vaccini freschi, Negozio","Agrispesa",5.35EUR,in stock,FORVAFRE23_24495,,,,0,new,published,,,,,,,
YOGVAINTEROBB3_2246_24501,"Yogurt di mucca bianco g 500","Yogurt di mucca bianco g 500",https://agrispesa.loc/wp-content/uploads/2023/02/default-300x300.png,https://agrispesa.loc/negozio/latticini/yogurt/yogurt-di-mucca-bianco-3/,"Yogurt","Agrispesa",6.29EUR,in stock,YOGVAINTEROBB3_2246_24501,,,,0,new,published,,,,,,,
CERFAR47_2309_24502,"Farina di cinque cereali kg 1","Le nostre farine biologiche e biodinamiche sono ottenute lavorando cereali da sementi non geneticamente modificate. I cereali vengono macinati con un impianto a laminatoi per le farine bianche e con macine in pietra naturale per le farine integrali e semintegrali. La macinazione con macine in pietra naturale di grande diametro a lenta rotazione rappresenta la soluzione ottimale per ottenere la più alta qualità e le migliori caratteristiche organolettiche. La farina ai cinque cereali è ottima per la produzione di pane, pizze, pasta e biscotti. Modalità di conservazione: conservare in luogo fresco ed asciutto. Farina ai cinque cereali. Ingredienti: farina di GRANO tenero tipo 0 (40%), farina di ORZO (20%), farina di SEGALE tipo 2 (20%), farina di AVENA (10%), farina di riso (10%). Allergeni: GRANO, SEGALE, ORZO, AVENA.",https://agrispesa.loc/wp-content/uploads/2023/02/default-300x300.png,https://agrispesa.loc/negozio/farina-di-cinque-cereali/,"Farine varie, Negozio","Agrispesa",6.92EUR,in stock,CERFAR47_2309_24502,,,,0,new,published,,,,,,,
CERFIO1_2309_24503,"Corn flakes g 250","Ricchi di carboidrati, proteine e fibre alimentari, mantengono il sapore del mais. Adatti alla colazione o alla merenda. Modalità di conservazione: conservare in luogo fresco e asciutto. Corn Flakes. Ingredienti: farina di mais, malto e sale. Può contenere tracce di cereali contenenti GLUTINE.",https://agrispesa.loc/wp-content/uploads/2023/02/default-300x300.png,https://agrispesa.loc/negozio/corn-flakes/,"Cereali in fiocchi, Negozio","Agrispesa",3.15EUR,in stock,CERFIO1_2309_24503,,,,0,new,published,,,,,,,
FORVAFRE26_2212_24496,"Nodini di mozzarella g 200 da aperitivo","Io preparo la mozzarella con i metodi tradizionali seguendo un procedimento noto da secoli. Le mie mozzarelle sono fatte con il latte crudo munto in giornata e ne conservano intatto il gusto e l'aroma. Il segreto della mozzarella tradizionale è il siero innesto. Al latte munto in giornata e portato alla temperatura di 37° C viene aggiunto, insieme al caglio, del siero delle lavorazioni precedenti che veicola i batteri lattici indispensabili per la maturazione della cagliata. Le mie mozzarelle quando vengono tagliate presentano un'abbondante fuoriuscita di latticello e profumano di latte. Dalla preparazione alla consegna al cliente passano meno di 4 giorni, pertanto sono sempre prodotti freschi. Trattandosi di lavorazioni artigianali, il prodotto difficilmente può essere sempre identico a se stesso. Una maggiore o minore compattezza e un sapore più o meno acidulo possono dipendere da fattori legati alla lavorazione giornaliera. Modalità di conservazione: conservare a +2/4°C.Mozzarella a latte crudo. Formaggio fresco a pasta filata.Ingredienti: LATTE, sale, caglio, acidificante: acido citrico, fermenti.Origine del latte: ITALIANumero di riconoscimento sanitario: IT Z986F CE",https://agrispesa.loc/wp-content/uploads/2023/02/default-300x300.png,https://agrispesa.loc/negozio/nodini-di-mozzarella/,"Vaccini freschi, Negozio","Agrispesa",6.17EUR,in stock,FORVAFRE26_2212_24496,,,,0,new,published,,,,,,,
FORVAFRE52_2212_24497,"Mozzarella g 250 senza sale","Come riconoscere la mozzarella di qualità? Guardando la confezione dobbiamo trovare l’indicazione che è stata ottenuta da latte crudo. Solo le mozzarelle a latte crudo sono realizzate con latte di qualità superiore che, avendo carica microbica ridotta, non necessita pastorizzazione prima della lavorazione. Se questa dicitura manca sappiamo che le mozzarelle sono realizzate con latte di qualità inferiore.Dopo l’apertura della confezione bisogna guardare la mozzarella. Deve presentare un aspetto umido e lucido, in caso contrario o non è stata conservata correttamente o non è mozzarella. Successivamente dobbiamo tagliare la mozzarella: lungo il taglio deve fuoriuscire abbondante latticello. Da questa indicazione possiamo capire se il formaggio è stato ottenuto da cagliata fresca o da cagliata conservata. Alcuni spacciano per prodotti italiani delle mozzarelle ottenute da cagliate fatte in altri Paesi, congelate, trasportate in Italia e solo allora filate. Quindi più una cagliata è stata conservata/trattata, minore sarà il quantitativo di latticello che uscirà dal taglio.Infine dobbiamo percepire il profumo del latte fresco e assaggiandole dobbiamo sentirne il gusto. Le mie mozzarelle sono fatte con il latte crudo munto in giornata e ne conservano intatto il gusto e l’aroma. Dalla preparazione alla consegna al cliente passano meno di 4 giorni, pertanto sono sempre prodotti freschi. Trattandosi di lavorazioni artigianali, il prodotto difficilmente può essere sempre identico a se stesso. Una maggiore o minore compattezza e un sapore più o meno acidulo possono dipendere da fattori legati alla lavorazione giornaliera. Modalità di conservazione: conservare in frigorifero a +4°C.Mozzarella. Formaggio fresco a pasta filata.Ingredienti: LATTE, caglio.Allergeni. Contiene LATTE.Origine del latte: ItaliaNumero di riconoscimento sanitario: IT Z986F CE",https://agrispesa.loc/wp-content/uploads/2023/02/default-300x300.png,https://agrispesa.loc/negozio/mozzarella-2/,"Senza sale o senza caglio, Negozio","Agrispesa",5.73EUR,in stock,FORVAFRE52_2212_24497,,,,0,new,published,,,,,,,
FORVAFRE54_2212_24498,"Nodini di mozzarella g 200 senza sale","Io preparo la mozzarella con i metodi tradizionali seguendo un procedimento noto da secoli. Le mie mozzarelle e i miei nodini di mozzarella sono fatti con il latte crudo munto in giornata e ne conservano intatto il gusto e l'aroma. Il segreto della mozzarella tradizionale e dei nodini di mozzarella è il siero innesto. Al latte munto in giornata e portato alla temperatura di 37° C viene aggiunto, insieme al caglio, del siero delle lavorazioni precedenti che veicola i batteri lattici indispensabili per la maturazione della cagliata. Le mie mozzarelle quando vengono tagliate presentano un'abbondante fuoriuscita di latticello e profumano di latte. 
  
  Dalla preparazione alla consegna al cliente passano meno di 4 giorni, pertanto sono sempre prodotti freschi. Trattandosi di lavorazioni artigianali, il prodotto difficilmente può essere sempre identico a sè stesso. Una maggiore o minore compattezza e un sapore più o meno acidulo possono dipendere da fattori legati alla lavorazione giornaliera.
  
  Non aggiungo il sale durante la lavorazione di questi nodini di mozzarella senza. Il sale, infatti, si mette mentre impasti la mozzarella: per i nodini senza sale, non lo aggiungo. E non vanno neanche in salamoia, perchè ci sarebbe del sale. Per questo i nodini di mozzarella senza sale sono un po’ più duri, perché, nella mozzarella, il sale aiuta un po’ a filare. 
  
  I nodini di mozzarella sono un classico, si devono fare a mano perché non c’è macchina; mentre per la mozzarella c’è chi usa la formatrice che lo può fare, i nodini di mozzarella si possono fare solo a mano. Non hanno inventato una macchina che fa i nodini di mozzarella. Nei nodini di mozzarella si sente la corda della filatura; nella mozzarella invece non si sente. 
  
  Nei nodini di mozzarella è come avere un mazzo di corde in mano, tu lo apri e senti le corde, dentro: la corda è fatto di tanti fili, nel nodino li senti tutti. 
  
  Consiglio d’uso: si presta a essere mangiato così, è una porzione piccola, se ne mangia uno a testa, a me piace il nodino per la sua consistenza, che è diversa da quella della mozzarella però lo mangio come la mozzarella, certo che per la caprese non va bene. La mozzarella la devi tagliare, perde il liquido, il nodino rimane più integro. 
  
  Ai matrimoni faccio i nodini piccoli che si mangiano così, a bocconi.",https://agrispesa.loc/wp-content/uploads/2023/02/default-300x300.png,https://agrispesa.loc/negozio/nodini-di-mozzarella-2/,"Senza sale o senza caglio, Negozio","Agrispesa",6.17EUR,in stock,FORVAFRE54_2212_24498,,,,0,new,published,,,,,,,
