id,title,description,image_link,link,product_type,brand,price,availability,item_group_id,checkout_url,additional_image_link,sale_price_effective_date,sale_price,condition,visibility,gender,color,size,pattern,google_product_category,default_product,variant
CARRVPOLPASUGO_2441_64379,"Polpa da sugo e polpette g 250","I bovini che alleviamo nella nostra azienda nascono in alpeggio in Val Maira. Nell’inverno successivo vengono spostati nella stalla a Castagnito d’Alba dove rimangono per circa un anno. Acquistiamo i bovini da un’azienda in Valle Varaita perché noi qua attorno abbiamo i vigneti e non possiamo allargare la stalla per dare stabulazione libera all’aperto della mucca col vitello; quindi le mucche le abbiamo tolte dalla nostra stalla, abbiamo tolto un pezzo di filiera per favorire il benessere dell’ingrasso. Prendo i vitelli nei cambi di stagione quando si muovono dalle stalle, quando vanno in alpeggio e quando tornano indietro. I vitelli che prendo hanno 6 mesi e sono tutti piemontesi. Sono già svezzati e mangiano il fieno con l’integrazione del mangime. Li porto nella mia stalla dove vivono 1 anno. L’alimentazione è a base di fieno che coltiviamo nei campi lungo il fiume Tanaro, sempre nel comune di Castagnito, e viene integrata con la somministrazione di cereali e legumi tostati, tutti ogm free. La qualità del mio prodotto, in questo caso della polpa da sugo e polpette, deriva, per una parte, dalla vita allo stato brado, dall’altra dall’alimentazione degli animali. Non abbiamo liquami perché facciamo stabulazione, la lettiera con la paglia, quindi tutto il letame che viene prodotto viene fatto maturare in un punto di stoccaggio, dopodiché viene sparso per le concimazioni organiche del vigneto e dei campi, dei seminativi. Per la sostenibilità abbiamo inserito casette per la nidificazione dei volatili per aumentare la biodiversità, insect house per la colonizzazione di insetti pronubi, animali nei campi per la gestione delle erbe infestanti, erbe spontanee più che infestanti. La caratteristica principale per la qualità della Polpa da sugo e polpette è che ha un contenuto di grassi bassissimo, non ha grasso all’interno della fibra, quindi è indicata per le diete a basso colesterolo ma allo stesso tempo è tenera.",https://agrispesa.loc/wp-content/uploads/2023/02/default-300x300.png,https://agrispesa.loc/negozio/carne-pesce/vitellone-per-sugo/polpa-da-sugo-e-polpette-g-250/,"Vitellone per sugo","Agrispesa",5.57EUR,in stock,CARRVPOLPASUGO_2441_64379,,,,0,new,published,,,,,,,
CARRVOSSOBUCO_2441_64377,"Ossobuchi g 500","I bovini che alleviamo nella nostra azienda nascono in alpeggio in Val Maira. Nell’inverno successivo vengono spostati nella stalla a Castagnito d’Alba dove rimangono per circa un anno. L’alimentazione è a base di fieno che coltiviamo nei campi lungo il fiume Tanaro, sempre nel comune di Castagnito, e viene integrata con la somministrazioni di cereali e legumi tostati, tutti ogm free.

Lo Stinco o Ossobuco è l'ultimo muscolo della coscia che abbraccia l'osso. Ottimo al forno, infarinato e cotto in umido con l'osso a tranci sottili.'§Codice di identificazione allevamento: IT046CN009
Modalità di conservazione: conservare da 0°C a + 4°C.
Da consumarsi previa cottura.

Allevato, macellato e sezionato in Italia",https://agrispesa.loc/wp-content/uploads/2023/02/default-300x300.png,https://agrispesa.loc/negozio/carne-pesce/vitellone-per-umido/ossobuchi-g-500/,"Vitellone per umido","Agrispesa",12.22EUR,in stock,CARRVOSSOBUCO_2441_64377,,,,0,new,published,,,,,,,
CARRVPOLPASCELT_2439_64378,"Polpa di prima scelta g 250","I bovini che alleviamo nella nostra azienda nascono in alpeggio in Val Maira. Nell’inverno successivo vengono spostati nella stalla a Castagnito d’Alba dove rimangono per circa un anno. Acquistiamo i bovini da un’azienda in Valle Varaita perché noi qua attorno abbiamo i vigneti e non possiamo allargare la stalla per dare stabulazione libera all’aperto della mucca col vitello; è impossibile, quindi le mucche le abbiamo tolte dalla nostra stalla, abbiamo tolto un pezzo di filiera per favorire il benessere dell’ingrasso. Prendo i vitelli nei cambi di stagione quando si muovono dalle stalle, quando vanno in alpeggio e quando tornano indietro. I vitelli che prendo hanno 6 mesi e sono tutti piemontesi. L’alimentazione è a base di fieno che coltiviamo nei campi lungo il fiume Tanaro, sempre nel comune di Castagnito, e viene integrata con la somministrazione di cereali e legumi tostati, tutti ogm free. La qualità del mio prodotto, in questo caso della polpa di prima scelta, deriva, per una parte, dalla vita allo stato brado, dall’altra dall’alimentazione degli animali. Non abbiamo liquami perché facciamo stabulazione, la lettiera con la paglia, quindi tutto il letame che viene prodotto viene fatto maturare in un punto di stoccaggio, dopodiché viene sparso per le concimazioni organiche del vigneto e dei campi, dei seminativi. La caratteristica principale per la qualità della polpa di prima scelta è che ha un contenuto di grassi bassissimo, non ha grasso all’interno della fibra, quindi è indicata per le diete a basso colesterolo ma allo stesso tempo è tenera.",https://agrispesa.loc/wp-content/uploads/2023/02/default-300x300.png,https://agrispesa.loc/negozio/carne-pesce/vitellone-per-cruda/polpa-di-prima-scelta-g-250/,"Vitellone per cruda","Agrispesa",7.56EUR,in stock,CARRVPOLPASCELT_2439_64378,,,,0,new,published,,,,,,,
CARRVNODINI_2441_64375,"Nodini a fette g 600 confezione da 2","I nodini a fette fanno parte del carré. I bovini che alleviamo nella nostra azienda nascono in alpeggio in Val Maira. Nell’inverno successivo vengono spostati nella stalla a Castagnito d’Alba dove rimangono per circa un anno. Acquistiamo i bovini da un’azienda in Valle Varaita perché noi qua attorno abbiamo i vigneti e non possiamo allargare la stalla per dare stabulazione libera all’aperto della mucca col vitello; è impossibile, quindi le mucche le abbiamo tolte dalla nostra stalla, abbiamo tolto un pezzo di filiera per favorire il benessere dell’ingrasso. Li compriamo in quella azienda perché sono animali sani, ci siamo sempre trovati bene. Prendo i vitelli nei cambi di stagione quando si muovono dalle stalle, quando vanno in alpeggio e quando tornano indietro. I vitelli che prendo hanno 6 mesi e sono tutti piemontesi. Sono già svezzati e mangiano il fieno con l’integrazione del mangime. Li porto nella mia stalla dove vivono 1 anno. L’alimentazione è a base di fieno che coltiviamo nei campi lungo il fiume Tanaro, sempre nel comune di Castagnito, e viene integrata con la somministrazione di cereali e legumi tostati, tutti ogm free. La qualità del mio prodotto, in questo caso dei Nodini a fette, deriva, per una parte, dalla vita allo stato brado, poi dall’alimentazione degli animali. Per la sostenibilità abbiamo inserito casette per la nidificazione dei volatili per aumentare la biodiversità, insect house per la colonizzazione di insetti pronubi, animali nei campi per la gestione delle erbe infestanti, erbe spontanee più che infestanti. La caratteristica principale per la qualità della carne (Nodini a fette confezione da 2) è che ha un contenuto di grassi bassissimo, non ha grasso all’interno della fibra, quindi è indicata per le diete a basso colesterolo ma allo stesso tempo è tenera.",https://agrispesa.loc/wp-content/uploads/2023/02/default-300x300.png,https://agrispesa.loc/negozio/carne-pesce/vitellone-per-umido/nodini-a-fette-g-600-confezione-da-2/,"Vitellone per umido","Agrispesa",21.2EUR,in stock,CARRVNODINI_2441_64375,,,,0,new,published,,,,,,,
CARRVOSSO1_2441_64376,"Osso da brodo kg 1","La caratteristica principale per la qualità dell’osso da brodo è che ha un contenuto di grassi bassissimo, non ha grasso all’interno della fibra, quindi è indicata per le diete a basso colesterolo ma allo stesso tempo è una carne molto tenera.
  
I bovini che alleviamo nella nostra azienda nascono in alpeggio in Val Maira. Nell’inverno successivo vengono spostati nella stalla a Castagnito d’Alba dove rimangono per circa un anno. 
  
Acquistiamo i bovini da un’azienda in Valle Varaita perché noi qua attorno abbiamo i vigneti e non possiamo allargare la stalla per dare stabulazione libera all’aperto della mucca col vitello; è impossibile, quindi le mucche le abbiamo tolte dalla nostra stalla, abbiamo tolto un pezzo di filiera per favorire il benessere dell’ingrasso. 
  
Li compriamo in quella azienda perché sono animali sani, ci siamo sempre trovati bene.
  
Prendo i vitelli nei cambi di stagione quando si muovono dalle stalle, quando vanno in alpeggio e quando tornano indietro. I vitelli che prendo hanno 6 mesi e sono tutti piemontesi.
  
L’alimentazione è a base di fieno che coltiviamo nei campi lungo il fiume Tanaro, sempre nel comune di Castagnito, e viene integrata con la somministrazione di cereali e legumi tostati, tutti ogm free.
  
La qualità del mio prodotto, in questo caso dell’osso da brodo, deriva, per una parte, dalla vita allo stato brado, dall’altra dall’alimentazione degli animali. 
  
  Per la sostenibilità abbiamo inserito casette per la nidificazione dei volatili per aumentare la biodiversità, insect house per la colonizzazione di insetti pronubi, animali nei campi per la gestione delle erbe infestanti, erbe spontanee più che infestanti.",https://agrispesa.loc/wp-content/uploads/2023/02/default-300x300.png,https://agrispesa.loc/negozio/carne-pesce/vitellone-per-brodo/osso-da-brodo-kg-1/,"Vitellone per brodo","Agrispesa",4.84EUR,in stock,CARRVOSSO1_2441_64376,,,,0,new,published,,,,,,,
CARRVCARPACCIO_2441_64373,"Carpaccio di coscia g 150","Una delle ricette tipiche dell’Albese è il carpaccio di coscia. 
Il carpaccio di coscia condita con olio extravergine di oliva, sale e pochissimo pepe, costituisce un piatto semplice, che appartiene solo alla tradizione albese e che tutti desiderano assaggiare quando visitano le Langhe o il Roero.
  
I bovini che alleviamo nella nostra azienda nascono in alpeggio in Val Maira. Nell’inverno successivo vengono spostati nella stalla a Castagnito d’Alba dove rimangono per circa un anno. 
  
Acquistiamo i bovini da un’azienda in Valle Varaita perché noi qua attorno abbiamo i vigneti e non possiamo allargare la stalla per dare stabulazione libera all’aperto della mucca col vitello; è impossibile, quindi le mucche le abbiamo tolte dalla nostra stalla, abbiamo tolto un pezzo di filiera per favorire il benessere dell’ingrasso. 
  
Li compriamo in quella azienda perché sono animali sani, ci siamo sempre trovati bene.
  
Prendo i vitelli nei cambi di stagione quando si muovono dalle stalle, quando vanno in alpeggio e quando tornano indietro. I vitelli che prendo hanno 6 mesi e sono tutti piemontesi.
  
Sono già svezzati e mangiano il fieno con l’integrazione del mangime. Li porto nella mia stalla dove vivono 1 anno.
  
L’alimentazione è a base di fieno che coltiviamo nei campi lungo il fiume Tanaro, sempre nel comune di Castagnito, e viene integrata con la somministrazione di cereali e legumi tostati, tutti ogm free.
  
La qualità del mio prodotto deriva, per una parte, dalla vita allo stato brado, poi dall’alimentazione degli animali. 
  
Non abbiamo liquami perché facciamo stabulazione, la lettiera con la paglia, quindi, tutto il letame che viene prodotto viene fatto maturare in un punto di stoccaggio, dopodiché viene sparso per le concimazioni organiche del vigneto e dei campi, dei seminativi.
  
Per la sostenibilità abbiamo inserito casette per la nidificazione dei volatili per aumentare la biodiversità, insect house per la colonizzazione di insetti pronubi, animali nei campi per la gestione delle erbe infestanti, erbe spontanee più che infestanti.",https://agrispesa.loc/wp-content/uploads/2023/02/default-300x300.png,https://agrispesa.loc/negozio/carne-pesce/vitellone-per-cruda/carpaccio-di-coscia-g-150/,"Vitellone per cruda","Agrispesa",5.81EUR,in stock,CARRVCARPACCIO_2441_64373,,,,0,new,published,,,,,,,
CARRVCOSTATA_2441_64374,"Costata g 500","La costata è la parte lombare della schiena che nel vitello collega il collo con le cosce. Deve avere una copertura esterna di grasso -copertura che si sviluppa nell’animale che ha mangiato liberamente- che rende il pezzo tutto molto più morbido. Il tempo di cottura è di circa 7 minuti per parte, 10 minuti sull’osso.
  
I bovini che alleviamo nella nostra azienda nascono in alpeggio in Val Maira. Nell’inverno successivo vengono spostati nella mia stalla a Castagnito d’Alba dove rimangono per circa un anno. 
  
Acquistiamo i bovini da un’azienda in Valle Varaita perché noi qua attorno abbiamo i vigneti e non possiamo allargare la stalla per dare stabulazione libera all’aperto della mucca con il vitello; è impossibile, quindi le mucche le abbiamo tolte dalla nostra stalla, abbiamo tolto un pezzo di filiera per favorire il benessere dell’ingrasso. 
  
Compriamo gli animali in quella azienda perché sono animali sani, ci siamo sempre trovati bene. Prendo i vitelli nei cambi di stagione quando si muovono dalle stalle, quando vanno in alpeggio e quando tornano indietro. I vitelli che prendo hanno 6 mesi e sono tutti piemontesi. Sono già svezzati e mangiano il fieno con l’integrazione del mangime. 
  
La loro alimentazione è a base di fieno che coltiviamo nei campi lungo il fiume Tanaro, sempre nel comune di Castagnito; viene integrata con la somministrazione di cereali e legumi tostati, tutti ogm free.
  
La qualità del mio prodotto deriva, per una parte, dalla vita allo stato brado, dall'altra parte dall’alimentazione degli animali. 
  
Non abbiamo liquami perché facciamo stabulazione, la lettiera con la paglia.",https://agrispesa.loc/wp-content/uploads/2023/02/default-300x300.png,https://agrispesa.loc/negozio/carne-pesce/vitellone-per-bistecche-grigliate/costata-g-500/,"Vitellone per bistecche","Agrispesa",17.67EUR,in stock,CARRVCOSTATA_2441_64374,,,,0,new,published,,,,,,,
CARRVBOLLITOMUS_2441_64371,"Muscolo g 800","Il muscolo è il muscolo della gamba, che si utilizza come bollito. È ideale per il lesso. Tempo di cottura: 50 minuti/kg. I bovini che alleviamo nella nostra azienda nascono in alpeggio in Val Maira. Nell’inverno successivo vengono spostati nella stalla a Castagnito d’Alba dove rimangono per circa un anno. Acquistiamo i bovini da un’azienda in Valle Varaita perché noi qua attorno abbiamo i vigneti e non possiamo allargare la stalla per dare stabulazione libera all’aperto della mucca col vitello; è impossibile, quindi le mucche le abbiamo tolte dalla nostra stalla, abbiamo tolto un pezzo di filiera per favorire il benessere dell’ingrasso. Li compriamo in quella azienda perché sono animali sani, ci siamo sempre trovati bene. Prendo i vitelli nei cambi di stagione quando si muovono dalle stalle, quando vanno in alpeggio e quando tornano indietro. I vitelli che prendo hanno 6 mesi e sono tutti piemontesi. L’alimentazione è a base di fieno che coltiviamo nei campi lungo il fiume Tanaro, sempre nel comune di Castagnito, e viene integrata con la somministrazione di cereali e legumi tostati, tutti ogm free. La qualità del mio prodotto, nel caso di specie il muscolo, deriva, per una parte, dalla vita allo stato brado, poi dall’alimentazione degli animali. Per la sostenibilità abbiamo inserito casette per la nidificazione dei volatili per aumentare la biodiversità, insect house per la colonizzazione di insetti pronubi, animali nei campi per la gestione delle erbe infestanti, erbe spontanee più che infestanti. La caratteristica principale per la qualità della carne è che ha un contenuto di grassi bassissimo, non ha grasso all’interno della fibra, quindi è indicata per le diete a basso colesterolo ma allo stesso tempo è tenera.",https://agrispesa.loc/wp-content/uploads/2023/02/default-300x300.png,https://agrispesa.loc/negozio/carne-pesce/vitellone-per-bolliti/muscolo-g-800/,"Vitellone per bolliti","Agrispesa",19.55EUR,in stock,CARRVBOLLITOMUS_2441_64371,,,,0,new,published,,,,,,,
CARRVBRUTEBUN_2441_64372,"Brut e bun g 800","Il brut e bun è la parte anteriore del vitello. Si utilizza per il bollito. I bovini che alleviamo nella nostra azienda nascono in alpeggio in Val Maira. Nell’inverno successivo vengono spostati nella stalla a Castagnito d’Alba dove rimangono per circa un anno. Acquistiamo i bovini da un’azienda in Valle Varaita perché noi qua attorno abbiamo i vigneti e non possiamo allargare la stalla per dare stabulazione libera all’aperto della mucca col vitello; è impossibile, quindi le mucche le abbiamo tolte dalla nostra stalla, abbiamo tolto un pezzo di filiera per favorire il benessere dell’ingrasso. Li compriamo in quella azienda perché sono animali sani e ci siamo sempre trovati bene. Prendo i vitelli nei cambi di stagione quando si muovono dalle stalle, quando vanno in alpeggio e quando tornano indietro. I vitelli che prendo hanno 6 mesi e sono tutti piemontesi. Sono già svezzati e mangiano il fieno con l’integrazione del mangime. Li porto nella mia stalla dove vivono 1 anno. L’alimentazione è a base di fieno che coltiviamo nei campi lungo il fiume Tanaro, sempre nel comune di Castagnito, e viene integrata con la somministrazione di cereali e legumi tostati, tutti ogm free. La qualità del mio prodotto, in questo caso del Brut e bun, deriva, per una parte, dalla vita allo stato brado, dall’altra dall’alimentazione degli animali. Non abbiamo liquami perché facciamo stabulazione, la lettiera con la paglia, quindi tutto il letame che viene prodotto viene fatto maturare in un punto di stoccaggio, dopodiché viene sparso per le concimazioni organiche del vigneto e dei campi, dei seminativi.",https://agrispesa.loc/wp-content/uploads/2023/02/default-300x300.png,https://agrispesa.loc/negozio/carne-pesce/vitellone-per-bolliti/brut-e-bun-g-800/,"Vitellone per bolliti","Agrispesa",19.55EUR,in stock,CARRVBRUTEBUN_2441_64372,,,,0,new,published,,,,,,,
CARRVARROSTO_2441_64369,"Arrosto g 800","È un arrosto magro, attaccato sia allo scamone che al primo taglio. Tempo di cottura: 40 minuti I bovini che alleviamo nella nostra azienda nascono in alpeggio in Val Maira. Nell’inverno successivo vengono spostati nella stalla a Castagnito d’Alba dove rimangono per circa un anno. Acquistiamo i bovini da un’azienda in Valle Varaita perché noi qua attorno abbiamo i vigneti e non possiamo allargare la stalla per dare stabulazione libera all’aperto della mucca col vitello; è impossibile, quindi le mucche le abbiamo tolte dalla nostra stalla, abbiamo tolto un pezzo di filiera per favorire il benessere dell’ingrasso. Li compriamo in quella azienda perché sono animali sani, ci siamo sempre trovati bene. Prendo i vitelli nei cambi di stagione quando si muovono dalle stalle, quando vanno in alpeggio e quando tornano indietro. I vitelli che prendo hanno 6 mesi e sono tutti piemontesi. L’alimentazione è a base di fieno che coltiviamo nei campi lungo il fiume Tanaro, sempre nel comune di Castagnito, e viene integrata con la somministrazione di cereali e legumi tostati, tutti ogm free. La qualità del mio prodotto deriva, per una parte, dalla vita allo stato brado, poi dall’alimentazione degli animali. Non abbiamo liquami perché facciamo stabulazione, la lettiera con la paglia, quindi tutto il letame che viene prodotto viene fatto maturare in un punto di stoccaggio, dopodiché viene sparso per le concimazioni organiche del vigneto e dei campi, dei seminativi. La caratteristica principale per la qualità della carne è che ha un contenuto di grassi bassissimo, non ha grasso all’interno della fibra, quindi è indicata per le diete a basso colesterolo ma allo stesso tempo è tenera.",https://agrispesa.loc/wp-content/uploads/2023/02/default-300x300.png,https://agrispesa.loc/negozio/carne-pesce/vitellone-per-arrosti/arrosto-g-800/,"Vitellone per arrosti","Agrispesa",23.04EUR,in stock,CARRVARROSTO_2441_64369,,,,0,new,published,,,,,,,
CARRVBATTUTA_2439_64370,"Battuta al coltello g 250","Una delle ricette tipiche dell’Albese è la carne battuta al coltello: la carne viene tagliata finemente con il coltello e non macinata, in modo che la consistenza rimanga croccante. La battuta al coltello condita con olio extravergine sale e pochissimo pepe, costituisce un piatto semplice, che appartiene solo alla tradizione albese e che tutti desiderano assaggiare quando visitano le Langhe o il Roero. La carne di vitello piemontese è una delle migliori in Italia, unica, con un tenore di grasso intramuscolare che la rende magra, ma particolarmente gustosa, e un tasso di colesterolo estremamente basso. I bovini che alleviamo nella nostra azienda nascono in alpeggio in Val Maira. Nell’inverno successivo vengono spostati nella stalla a Castagnito d’Alba dove rimangono per circa un anno. Acquistiamo i bovini da un’azienda in Valle Varaita perché noi qua attorno abbiamo i vigneti e non possiamo allargare la stalla per dare stabulazione libera all’aperto della mucca col vitello; è impossibile, quindi le mucche le abbiamo tolte dalla nostra stalla, abbiamo tolto un pezzo di filiera per favorire il benessere dell’ingrasso. Li compriamo in quella azienda perché sono animali sani, ci siamo sempre trovati bene. Prendo i vitelli nei cambi di stagione quando si muovono dalle stalle, quando vanno in alpeggio e quando tornano indietro. I vitelli che prendo hanno 6 mesi e sono tutti piemontesi. Sono già svezzati e mangiano il fieno con l’integrazione del mangime. Li porto nella mia stalla dove vivono 1 anno. L’alimentazione è a base di fieno che coltiviamo nei campi lungo il fiume Tanaro, sempre nel comune di Castagnito, e viene integrata con la somministrazione di cereali e legumi tostati, tutti ogm free. La qualità del mio prodotto deriva, per una parte, dalla vita allo stato brado, poi dall’alimentazione degli animali.",https://agrispesa.loc/wp-content/uploads/2023/02/default-300x300.png,https://agrispesa.loc/negozio/carne-pesce/vitellone-per-cruda/battuta-al-coltello-g-250/,"Vitellone per cruda","Agrispesa",7.5EUR,in stock,CARRVBATTUTA_2439_64370,,,,0,new,published,,,,,,,
CARRBSOTTOFILE1_2439_64367,"Sottofiletto a fette g 250","I bovini che alleviamo nella nostra azienda nascono in alpeggio in Val Maira. Nell’inverno successivo vengono spostati nella stalla a Castagnito d’Alba dove rimangono per circa un anno. L’alimentazione è a base di fieno che coltiviamo nei campi lungo il fiume Tanaro, sempre nel comune di Castagnito, e viene integrata con la somministrazioni di cereali e legumi tostati, tutti ogm free.Ancorato alle vertebre, è la parte centrale della schiena, ideale da fare ai ferri. Codice di identificazione allevamento: IT046CN009Modalità di conservazione: conservare da 0°C a + 4°C.
  Da consumarsi previa cottura.Allevato, macellato e sezionato in Italia",https://agrispesa.loc/wp-content/uploads/2023/02/default-300x300.png,https://agrispesa.loc/negozio/carne-pesce/vitellone-per-bistecche-grigliate/sottofiletto-a-fette-g-250/,"Vitellone per bistecche","Agrispesa",9.68EUR,in stock,CARRBSOTTOFILE1_2439_64367,,,,0,new,published,,,,,,,
CARRBSOTTOFILET_2441_64368,"Sottofiletto intero g 500","I bovini che alleviamo nella nostra azienda nascono in alpeggio in Val Maira. Nell’inverno successivo vengono spostati nella stalla a Castagnito d’Alba dove rimangono per circa un anno. L’alimentazione è a base di fieno che coltiviamo nei campi lungo il fiume Tanaro, sempre nel comune di Castagnito, e viene integrata con la somministrazioni di cereali e legumi tostati, tutti ogm free.Ancorato alle vertebre, è la parte centrale della schiena, ideale da fare ai ferri. Codice di identificazione allevamento: IT046CN009Modalità di conservazione: conservare da 0°C a + 4°C.
  Da consumarsi previa cottura.Allevato, macellato e sezionato in Italia",https://agrispesa.loc/wp-content/uploads/2023/02/default-300x300.png,https://agrispesa.loc/negozio/carne-pesce/vitellone-per-bistecche-grigliate/sottofiletto-intero-g-500/,"Vitellone per bistecche","Agrispesa",19.36EUR,in stock,CARRBSOTTOFILET_2441_64368,,,,0,new,published,,,,,,,
